projectId,env,qtiId,title,order,href,placementType,topic,topicOrder,source,frontText,backText,resourceId,errors
"1b065b0f-6f0a-468d-802f-7cc556f1e432",PROD,"a74c54ea-531f-4d9f-8e94-904f9ad62004",fc862918.AplSG5E.2.002,165,"fc862918.AplSG5E.2.002.xml",topic,"Flashcards 1: Exam 220-1102",2,SYBEX,"Can you mix 64&hyphen;bit software with 32&hyphen;bit hardware?","You cannot mix 64&hyphen;bit software with 32&hyphen;bit hardware.","01J8M63CXFP5BRGMNNME3D6MAT",
"1b065b0f-6f0a-468d-802f-7cc556f1e432",PROD,"6338e2ad-db1c-4003-a4bf-7eefdad90896",fc862918.AplSG5E.2.003,166,"fc862918.AplSG5E.2.003.xml",topic,"Flashcards 1: Exam 220-1102",2,SYBEX,"What are the terms used to describe proprietary and nonproprietary programming code?","Closed source/vendor specific and open source, respectively","01J8M63D3S058NV5VM4BEWCV59",
"1b065b0f-6f0a-468d-802f-7cc556f1e432",PROD,"5e872b0d-1205-4f96-94c0-d0f57fda6821",fc862918.AplSG5E.2.004,167,"fc862918.AplSG5E.2.004.xml",topic,"Flashcards 1: Exam 220-1102",2,SYBEX,"The name of the area on the mobile phone that contains the icons for apps is called what?","The launcher or GUI","01J8M63D9H2VDB36HQCD6AYA65",
"1b065b0f-6f0a-468d-802f-7cc556f1e432",PROD,"6394265b-2bd9-4d5a-9442-055001de7383",fc862918.AplSG5E.2.005,168,"fc862918.AplSG5E.2.005.xml",topic,"Flashcards 1: Exam 220-1102",2,SYBEX,"A 32&hyphen;bit operating system has a ____________ RAM limitation.","4 GB","01J8M63DFC99XJHEMXFSYSSDG4",
"1b065b0f-6f0a-468d-802f-7cc556f1e432",PROD,"b9ba28d8-4966-461c-9b3a-47f889780829",fc862918.AplSG5E.2.006,169,"fc862918.AplSG5E.2.006.xml",topic,"Flashcards 1: Exam 220-1102",2,SYBEX,"The ability of a single application to have multiple requests in to the processor at one time is known as ______.",Multithreading,"01J8M63DN3MY2386S53WGRJW9E",
"1b065b0f-6f0a-468d-802f-7cc556f1e432",PROD,"aa0e5b1a-6410-4d5b-b637-8bd7a9f69008",fc862918.AplSG5E.2.007,170,"fc862918.AplSG5E.2.007.xml",topic,"Flashcards 1: Exam 220-1102",2,SYBEX,"In Windows, a primary mouse click is typically a single click of which mouse button?",Left,"01J8M63DV465B3HX0D4RCYC1SM",
"1b065b0f-6f0a-468d-802f-7cc556f1e432",PROD,"f7410c9a-3fc0-41a0-9758-81dfee665720",fc862918.AplSG5E.2.008,171,"fc862918.AplSG5E.2.008.xml",topic,"Flashcards 1: Exam 220-1102",2,SYBEX,"Which Settings app category is used to configure screensavers, colors, display options, and monitor drivers in Windows 10?",Personalization,"01J8M63E0B7WH71QPRV5MH9BR6",
"1b065b0f-6f0a-468d-802f-7cc556f1e432",PROD,"d440d100-3fa7-461d-a88d-d5c8950f6ed4",fc862918.AplSG5E.2.009,172,"fc862918.AplSG5E.2.009.xml",topic,"Flashcards 1: Exam 220-1102",2,SYBEX,"What online location was created for users to find apps for use with Windows 8, 8.1, and 10?","Windows Store (now called the Microsoft Store)","01J8M63E64Z2A2HAE548K5BHH1",
"1b065b0f-6f0a-468d-802f-7cc556f1e432",PROD,"276756c5-caa5-4e85-adef-3639855ef068",fc862918.AplSG5E.2.010,173,"fc862918.AplSG5E.2.010.xml",topic,"Flashcards 1: Exam 220-1102",2,SYBEX,"The __________ feature of Windows allows you to use drive&hyphen;level encryption to protect files, including those needed for startup and logon.",BitLocker,"01J8M63EB8MB8KHX6XZHGJKMAK",
"1b065b0f-6f0a-468d-802f-7cc556f1e432",PROD,"4f1924b0-c566-4c13-ae4b-2526c3f745ab",fc862918.AplSG5E.2.011,174,"fc862918.AplSG5E.2.011.xml",topic,"Flashcards 1: Exam 220-1102",2,SYBEX,"Windows includes the ______ antispyware program.","Windows Defender Antivirus","01J8M63EGQ2KBH0NPBQF8K1KDC",
"1b065b0f-6f0a-468d-802f-7cc556f1e432",PROD,"3b8c9a3c-21b8-4061-9807-42984776c8d4",fc862918.AplSG5E.2.012,175,"fc862918.AplSG5E.2.012.xml",topic,"Flashcards 1: Exam 220-1102",2,SYBEX,"The ________ is responsible for rendering graphics?","graphics processing unit (GPU)","01J8M63EP219Y8HFC1YY2PRQF0",
"1b065b0f-6f0a-468d-802f-7cc556f1e432",PROD,"5dcbd72a-de6a-4bea-b2fe-901b4228c05f",fc862918.AplSG5E.2.013,176,"fc862918.AplSG5E.2.013.xml",topic,"Flashcards 1: Exam 220-1102",2,SYBEX,"32&hyphen;bit Windows 10 requires at least _______ of free disk space.","16 GB","01J8M63EVC886XT4FS4HPG49A8",
"1b065b0f-6f0a-468d-802f-7cc556f1e432",PROD,"1e85f6c4-12e7-44e2-bca3-148834dc0502",fc862918.AplSG5E.2.014,177,"fc862918.AplSG5E.2.014.xml",topic,"Flashcards 1: Exam 220-1102",2,SYBEX,"In Windows, every user is automatically given a user _____ when they log on to the workstation that contains information about the user&rsquo;s settings and preferences.",Profile,"01J8M63F0TZNES3XB2EH217WB7",
"1b065b0f-6f0a-468d-802f-7cc556f1e432",PROD,"ccec0e2f-47a0-4d76-9e4a-da2627eb6a1a",fc862918.AplSG5E.2.015,178,"fc862918.AplSG5E.2.015.xml",topic,"Flashcards 1: Exam 220-1102",2,SYBEX,"___________________ is a distributed filesystem common to UNIX/Linux&hyphen;based systems that allows a user on a client computer to access files over a network.","NFS (Network File System)","01J8M63F63CND25GXKMQRW4331",
"1b065b0f-6f0a-468d-802f-7cc556f1e432",PROD,"acd16499-ad03-4653-8a55-cc367a6f7be1",fc862918.AplSG5E.2.016,179,"fc862918.AplSG5E.2.016.xml",topic,"Flashcards 1: Exam 220-1102",2,SYBEX,"The ________ utility can be used to schedule a shutdown (complete or a restart) locally or remotely.","<code>SHUTDOWN.EXE</code>","01J8M63FBH20NWEPBBJ23XF3DK",
"1b065b0f-6f0a-468d-802f-7cc556f1e432",PROD,"6957914e-df80-423b-8ad2-0c5655c1bccf",fc862918.AplSG5E.2.017,180,"fc862918.AplSG5E.2.017.xml",topic,"Flashcards 1: Exam 220-1102",2,SYBEX,"The __________ feature of Windows allows you to use drive encryption to protect files, including those needed for startup and logon.",BitLocker,"01J8M63FH1T2ZZVGHS8GDNHXDQ",
"1b065b0f-6f0a-468d-802f-7cc556f1e432",PROD,"0e6a9e08-27d9-41f5-9b3f-970d46f9ea9a",fc862918.AplSG5E.2.018,181,"fc862918.AplSG5E.2.018.xml",topic,"Flashcards 1: Exam 220-1102",2,SYBEX,"___________________ is the process of dividing part or all of a hard drive into sections, or partitions, for use by the computer.",Partitioning,"01J8M63CG83PVZJFDJVQWGZF6F",
"1b065b0f-6f0a-468d-802f-7cc556f1e432",PROD,"a90aa2c1-4cb6-40bd-8da4-a8f2bce0f046",fc862918.AplSG5E.2.019,182,"fc862918.AplSG5E.2.019.xml",topic,"Flashcards 1: Exam 220-1102",2,SYBEX,"The _______ filesystem was the original filesystem used by Apple.","Hierarchical File System (HFS)","01J8M63CNH4WPZ0E5K7950JPH4",
"1b065b0f-6f0a-468d-802f-7cc556f1e432",PROD,"8648e03e-cb07-4b28-aa42-6b18c042876a",fc862918.AplSG5E.2.020,183,"fc862918.AplSG5E.2.020.xml",topic,"Flashcards 1: Exam 220-1102",2,SYBEX,"__________ allows you to remotely connect to the Windows operating system.","Remote Desktop","01J8M63CV97P2J0C6TCWA29WA0",
"1b065b0f-6f0a-468d-802f-7cc556f1e432",PROD,"ea8f5743-1742-4ecf-9c2f-440f4b85e07d",fc862918.AplSG5E.2.021,184,"fc862918.AplSG5E.2.021.xml",topic,"Flashcards 1: Exam 220-1102",2,SYBEX,"The _______________ allow you to configure what happens when you close the lid of the laptop.","Power Options","01J8M63D0X46Z0XQ4VPT3FJDFR",
"1b065b0f-6f0a-468d-802f-7cc556f1e432",PROD,"c57204d8-c4d7-4c0e-bc24-1ad0636621bf",fc862918.AplSG5E.2.022,185,"fc862918.AplSG5E.2.022.xml",topic,"Flashcards 1: Exam 220-1102",2,SYBEX,"The ______________ tool can clean up operating system files in an attempt to free up space.","Disk Cleanup","01J8M63D6FP89WYQHBKDS01ET6",
"1b065b0f-6f0a-468d-802f-7cc556f1e432",PROD,"abf0dde4-385f-49e4-bf41-8dcb86f208cd",fc862918.AplSG5E.2.023,186,"fc862918.AplSG5E.2.023.xml",topic,"Flashcards 1: Exam 220-1102",2,SYBEX,"On traditional hard disk drives, the _____ contains the partition information for the hard drive, and it includes the beginning and end of each partition that has been defined on the drive.","Master Boot Record (MBR)","01J8M63DC0C0TR0KWDX6G293PF",
"1b065b0f-6f0a-468d-802f-7cc556f1e432",PROD,"a7757c4a-81e5-4f91-9763-fe6a06a3b90c",fc862918.AplSG5E.2.024,187,"fc862918.AplSG5E.2.024.xml",topic,"Flashcards 1: Exam 220-1102",2,SYBEX,"In Windows, which command&hyphen;line tool allows you to view all installed hardware, resources, and applications?",MSINFO32,"01J8M63DJ4EF5GYZGX5XHNVB94",
"1b065b0f-6f0a-468d-802f-7cc556f1e432",PROD,"baee42b1-cda2-4b8f-9333-d6203fac66e6",fc862918.AplSG5E.2.025,188,"fc862918.AplSG5E.2.025.xml",topic,"Flashcards 1: Exam 220-1102",2,SYBEX,"The ______________ applet allows full&hyphen;drive encryption.",BitLocker,"01J8M63DQ8GHNFSPQP58YJSD8B",
"1b065b0f-6f0a-468d-802f-7cc556f1e432",PROD,"a94a7f10-fed8-4976-88e8-53a5fb9827f1",fc862918.AplSG5E.2.026,189,"fc862918.AplSG5E.2.026.xml",topic,"Flashcards 1: Exam 220-1102",2,SYBEX,"In Windows, which option places the computer into a state in which the session is saved and can be restored but the monitor and hard disks are turned off?",Sleep,"01J8M63DWV1WP1ZR8S8ZRGX1MT",
"1b065b0f-6f0a-468d-802f-7cc556f1e432",PROD,"3d17f5df-4071-4e6a-81bf-075ed6ad8faf",fc862918.AplSG5E.2.027,190,"fc862918.AplSG5E.2.027.xml",topic,"Flashcards 1: Exam 220-1102",2,SYBEX,"You need to delay the installation of Windows Updates for Windows 10; which branch will you use?","Semi&hyphen;Annual Channel (Targeted)","01J8M638GXAHG9DRNVEKEDTYN9",
"1b065b0f-6f0a-468d-802f-7cc556f1e432",PROD,"f7e1de9c-4421-4ea0-84db-6a9d110e28ad",fc862918.AplSG5E.2.028,191,"fc862918.AplSG5E.2.028.xml",topic,"Flashcards 1: Exam 220-1102",2,SYBEX,"The command ____________ will place a filesystem on a volume.",<code>Format</code>,"01J8M63B0J496MMMDFT1HX5F69",
"1b065b0f-6f0a-468d-802f-7cc556f1e432",PROD,"75c4f76b-56c8-4448-a6b7-5d80f6900e9a",fc862918.AplSG5E.2.029,192,"fc862918.AplSG5E.2.029.xml",topic,"Flashcards 1: Exam 220-1102",2,SYBEX,"The ____________ authentication model uses claims to authenticate users.","single sign&hyphen;on (SSO)","01J8M63B88023K1A7PZ7G0JEFA",
"1b065b0f-6f0a-468d-802f-7cc556f1e432",PROD,"039c9002-77f7-48c2-acdc-d837ba87eee2",fc862918.AplSG5E.2.030,193,"fc862918.AplSG5E.2.030.xml",topic,"Flashcards 1: Exam 220-1102",2,SYBEX,"A _______________ is a path for addressing network shares.","Universal Naming Convention (UNC)","01J8M63BF2C02ZPCX9QS8A6PWR",
"1b065b0f-6f0a-468d-802f-7cc556f1e432",PROD,"d35e0847-6f5d-4fb4-bb9b-30affefaef18",fc862918.AplSG5E.2.031,194,"fc862918.AplSG5E.2.031.xml",topic,"Flashcards 1: Exam 220-1102",2,SYBEX,"After using the <code>winver</code> command you find out you have Windows 10 version 1803 build 17134.345. When was the update released by Microsoft?",43160,"01J8M63BMSR6PXS3B43THME7YD",
"1b065b0f-6f0a-468d-802f-7cc556f1e432",PROD,"4f7086f1-45bc-44c1-a406-80caed2c6d4e",fc862918.AplSG5E.2.032,195,"fc862918.AplSG5E.2.032.xml",topic,"Flashcards 1: Exam 220-1102",2,SYBEX,"The _______________ command can copy files along with their security and ownership.",<code>Robocopy</code>,"01J8M63BT33GBVMJKEN9M12F39",
"1b065b0f-6f0a-468d-802f-7cc556f1e432",PROD,"dcc3913d-aff2-4c36-bece-ab4ef07fdb8e",fc862918.AplSG5E.2.033,196,"fc862918.AplSG5E.2.033.xml",topic,"Flashcards 1: Exam 220-1102",2,SYBEX,"What is the name of the BIOS that supports Secure Boot?","Unified Extensible Firmware Interface (UEFI)","01J8M63BZKXCSN40YHCTTNMSCT",
"1b065b0f-6f0a-468d-802f-7cc556f1e432",PROD,"45b0eb9f-1f15-4d68-9ef1-7855aa60c487",fc862918.AplSG5E.2.034,197,"fc862918.AplSG5E.2.034.xml",topic,"Flashcards 1: Exam 220-1102",2,SYBEX,"The ______________ command is used for applying Group Policy via the command line.",<code>gpupdate</code>,"01J8M63C4RNQRXC4J296HHWRXC",
"1b065b0f-6f0a-468d-802f-7cc556f1e432",PROD,"ecfdc4ae-66ac-4b3e-aaf8-63d88f1a74e1",fc862918.AplSG5E.2.035,198,"fc862918.AplSG5E.2.035.xml",topic,"Flashcards 1: Exam 220-1102",2,SYBEX,"After upgrading to Windows 10, which folder contains the prior version of Windows?","<code>C:\\\\Windows.old</code>","01J8M65XFSE7HJWXHPHNG5NW4P",
"1b065b0f-6f0a-468d-802f-7cc556f1e432",PROD,"a30ac946-9a26-4186-8796-44939a97a054",fc862918.AplSG5E.2.036,199,"fc862918.AplSG5E.2.036.xml",topic,"Flashcards 1: Exam 220-1102",2,SYBEX,"Which Windows 10 networking feature allows for the sharing of files and printers and local user accounts?",workgroup,"01J8M63FKKH5MT57NDA4QVJ51J",
"1b065b0f-6f0a-468d-802f-7cc556f1e432",PROD,"cd190d26-5ca5-47fb-bca3-55a6d36765ba",fc862918.AplSG5E.2.037,200,"fc862918.AplSG5E.2.037.xml",topic,"Flashcards 1: Exam 220-1102",2,SYBEX,"What is the administrative share print$ used for?","sharing of print drivers","01J8M63FRY9TYAQRYRC8HV8MFS",
"1b065b0f-6f0a-468d-802f-7cc556f1e432",PROD,"b08e5600-76c6-461a-8d91-70672968c1a2",fc862918.AplSG5E.2.038,201,"fc862918.AplSG5E.2.038.xml",topic,"Flashcards 1: Exam 220-1102",2,SYBEX,"The ____________ command is used to identify the version of the operating system.",<code>winver</code>,"01J8M63FY68ZWHF32GJANAZV9W",
"1b065b0f-6f0a-468d-802f-7cc556f1e432",PROD,"e06db0ce-af4d-4b31-9622-09d41a098df9",fc862918.AplSG5E.2.039,202,"fc862918.AplSG5E.2.039.xml",topic,"Flashcards 1: Exam 220-1102",2,SYBEX,"A __________________ is a connection that utilizes cellular technology to connect the operating system to the Internet.",WWAN,"01J8M63G3THAJMV6HP2NS20E9J",
"1b065b0f-6f0a-468d-802f-7cc556f1e432",PROD,"e8ec8651-da0a-4755-856b-49bbf6c089c2",fc862918.AplSG5E.2.040,203,"fc862918.AplSG5E.2.040.xml",topic,"Flashcards 1: Exam 220-1102",2,SYBEX,"The _____________ command will return the name of the operating system.",<code>hostname</code>,"01J8M63G91ZJ3EZR034Q1T2A6G",
"1b065b0f-6f0a-468d-802f-7cc556f1e432",PROD,"b989345d-6708-4dd2-a9fe-ace5208af7ad",fc862918.AplSG5E.2.041,204,"fc862918.AplSG5E.2.041.xml",topic,"Flashcards 1: Exam 220-1102",2,SYBEX,"___________________ is a password management system from Apple.",Keychain,"01J8M63GERKPVVN3E6K33JG24V",
"1b065b0f-6f0a-468d-802f-7cc556f1e432",PROD,"af03820a-86b2-4299-85d9-baf21edfdf26",fc862918.AplSG5E.2.042,205,"fc862918.AplSG5E.2.042.xml",topic,"Flashcards 1: Exam 220-1102",2,SYBEX,"The __________ command in Linux allows you to view the contents of a text file.",<code>cat</code>,"01J8M63GMYW9KT5DYDX2QZ02TT",
"1b065b0f-6f0a-468d-802f-7cc556f1e432",PROD,"921960a2-762b-4698-994a-aa2c6ceb97bc",fc862918.AplSG5E.2.043,206,"fc862918.AplSG5E.2.043.xml",topic,"Flashcards 1: Exam 220-1102",2,SYBEX,"In Linux, the _______ allows you to interact with the system at the command line.","terminal, or command prompt","01J8M63GSZEKWB4V7VTZV3PWSJ",
"1b065b0f-6f0a-468d-802f-7cc556f1e432",PROD,"90d23a51-450c-463b-9c80-882ae960019a",fc862918.AplSG5E.2.044,207,"fc862918.AplSG5E.2.044.xml",topic,"Flashcards 1: Exam 220-1102",2,SYBEX,"The ____________ command allows you to change a user&rsquo;s password in Linux.",<code>passwd</code>,"01J8M63GZM78STBCRG36P4V9B4",
"1b065b0f-6f0a-468d-802f-7cc556f1e432",PROD,"0c5668f5-3b38-4bde-b593-e4734233c9e2",fc862918.AplSG5E.2.045,208,"fc862918.AplSG5E.2.045.xml",topic,"Flashcards 1: Exam 220-1102",2,SYBEX,"Which Linux utility can be used with wildcards to find matches for a regular expression in a text file?",<code>grep</code>,"01J8M63E2NMFZNKZ2C1H6A36VA",
"1b065b0f-6f0a-468d-802f-7cc556f1e432",PROD,"def43d29-d199-4951-80cf-61179da6b21a",fc862918.AplSG5E.2.046,209,"fc862918.AplSG5E.2.046.xml",topic,"Flashcards 1: Exam 220-1102",2,SYBEX,"The ____________ macOS utility allows a user to manage stored credentials.",Keychain,"01J8M63E8CV19KY8KNGAZ1TECF",
"1b065b0f-6f0a-468d-802f-7cc556f1e432",PROD,"20bf1558-594b-4fc0-962a-19b5d1a885d5",fc862918.AplSG5E.2.047,210,"fc862918.AplSG5E.2.047.xml",topic,"Flashcards 1: Exam 220-1102",2,SYBEX,"___________ is a simple text editor for Linux.",<code>pico</code>,"01J8M63EDXDZZQJRBHRCRBXAT2",
"1b065b0f-6f0a-468d-802f-7cc556f1e432",PROD,"2bf4d04c-ed63-4f6b-96e2-961dbdf19115",fc862918.AplSG5E.2.048,211,"fc862918.AplSG5E.2.048.xml",topic,"Flashcards 1: Exam 220-1102",2,SYBEX,"To edit text files, such as configuration files, _______________ can be used for backup and cloud storage on Apple operating systems.",iCloud,"01J8M63EKVKEGS4QJCW9WYEFS4",
"1b065b0f-6f0a-468d-802f-7cc556f1e432",PROD,"16fcb54d-0236-4a76-a886-ba7ffc861e9e",fc862918.AplSG5E.2.049,212,"fc862918.AplSG5E.2.049.xml",topic,"Flashcards 1: Exam 220-1102",2,SYBEX,"If you type <code>pwd</code> at a Linux command line, what will be the result?","The shell will echo back the present working directory.","01J8M63ESPCV6ECN0NBG8AHMC5",
"1b065b0f-6f0a-468d-802f-7cc556f1e432",PROD,"61e1df7a-c00c-4c78-8bb5-752a5e2f0714",fc862918.AplSG5E.2.050,213,"fc862918.AplSG5E.2.050.xml",topic,"Flashcards 1: Exam 220-1102",2,SYBEX,"If you type <code>passwd</code> at the command prompt in Linux, what will be the result?","You will be prompted to change your password.","01J8M63EYX7ZKHZD7Z6GB7WNNJ",
"1b065b0f-6f0a-468d-802f-7cc556f1e432",PROD,"5dc42284-f8ac-458b-9a06-3d3ff950c69b",fc862918.AplSG5E.2.051,214,"fc862918.AplSG5E.2.051.xml",topic,"Flashcards 1: Exam 220-1102",2,SYBEX,"What Linux command do you use to run one command with elevated privileges?",<code>sudo</code>,"01J8M63F41EWD5YM80QD4Z9A33",
"1b065b0f-6f0a-468d-802f-7cc556f1e432",PROD,"88f58c87-acf1-466c-84d1-cf7d80068e08",fc862918.AplSG5E.2.052,215,"fc862918.AplSG5E.2.052.xml",topic,"Flashcards 1: Exam 220-1102",2,SYBEX,"What command can you use in Linux to change the permissions of an existing file?",<code>Chmod</code>,"01J8M63F95P1PNBGWSM75X9Q0W",
"1b065b0f-6f0a-468d-802f-7cc556f1e432",PROD,"5f303aae-2d29-4941-943d-4ef8168aa661",fc862918.AplSG5E.2.053,216,"fc862918.AplSG5E.2.053.xml",topic,"Flashcards 1: Exam 220-1102",2,SYBEX,"The act of digging in the trash in the expectation of gaining confidential information is ___________________ .","dumpster diving","01J8M63FEEBWGGHKY8B9FN01E2",
"1b065b0f-6f0a-468d-802f-7cc556f1e432",PROD,"3c69bd1a-cead-49a3-a67d-728cb6fbad1c",fc862918.AplSG5E.2.054,217,"fc862918.AplSG5E.2.054.xml",topic,"Flashcards 1: Exam 220-1102",2,SYBEX,"If someone is so close to you when you enter a building that they are able to come in right behind you without needing to use a key, a card, or any other security device, they are said to be ___________________",tailgating,"01J8M63GMW4ADA8FB7NWW47CFD",
"1b065b0f-6f0a-468d-802f-7cc556f1e432",PROD,"ba1d0788-3302-4d67-868e-bb5ac13c7400",fc862918.AplSG5E.2.055,218,"fc862918.AplSG5E.2.055.xml",topic,"Flashcards 1: Exam 220-1102",2,SYBEX,"__________________ devices such as hand scanners and retinal scanners use physical characteristics to identify the user.",Biometric,"01J8M63GSW28YS86SDHYQB7AGK",
"1b065b0f-6f0a-468d-802f-7cc556f1e432",PROD,"179d4a88-8549-42fc-a2c6-de7c9b2e29b2",fc862918.AplSG5E.2.056,219,"fc862918.AplSG5E.2.056.xml",topic,"Flashcards 1: Exam 220-1102",2,SYBEX,"What is the name of film or glass add&hyphen;ons that are placed over a monitor to prevent the data on the screen from being readable when viewed from the sides?","Privacy filters","01J8M63GYY0FCYK530G45VF08E",
"1b065b0f-6f0a-468d-802f-7cc556f1e432",PROD,"51b9ae73-7086-4b2f-be97-5a46781493da",fc862918.AplSG5E.2.057,220,"fc862918.AplSG5E.2.057.xml",topic,"Flashcards 1: Exam 220-1102",2,SYBEX,"A firewall operating as a(n) _______ passes or blocks traffic to specific addresses based on the type of application.","packet filter","01J8M63H4QT84JXPAVTPFXK0AP",
"1b065b0f-6f0a-468d-802f-7cc556f1e432",PROD,"336330f6-a0e0-4abc-8378-c040c263745e",fc862918.AplSG5E.2.058,221,"fc862918.AplSG5E.2.058.xml",topic,"Flashcards 1: Exam 220-1102",2,SYBEX,"The principle of ___________________is a simple one: when assigning permissions, give users only the permissions that they need to do their work and no more.","least privilege","01J8M63HAEG5M13N8ECGJDS12N",
"1b065b0f-6f0a-468d-802f-7cc556f1e432",PROD,"9ba83f2d-f732-4e7b-92b2-c969a00a9cf4",fc862918.AplSG5E.2.059,222,"fc862918.AplSG5E.2.059.xml",topic,"Flashcards 1: Exam 220-1102",2,SYBEX,"___________________ is a process in which an attacker attempts to acquire information about your network and system by social means, such as talking to people in the organization.","Social engineering","01J8M63HMEESQ38FYRP58N9M07",
"1b065b0f-6f0a-468d-802f-7cc556f1e432",PROD,"e328c2bc-6172-4160-a543-a75f0fb2df0f",fc862918.AplSG5E.2.060,223,"fc862918.AplSG5E.2.060.xml",topic,"Flashcards 1: Exam 220-1102",2,SYBEX,"What is a type of malicious software that acts on behalf of a third party? (Rather than self&hyphen;replicating, like viruses and worms, it is spread to machines by users who inadvertently ask for it.)",Spyware,"01J8M63HYD4KXWQ7PTX60GRBS7",
"1b065b0f-6f0a-468d-802f-7cc556f1e432",PROD,"9049c2dc-c3b2-41bf-9528-d9a42e358e79",fc862918.AplSG5E.2.061,224,"fc862918.AplSG5E.2.061.xml",topic,"Flashcards 1: Exam 220-1102",2,SYBEX,"___________________ is a form of social engineering in which you simply ask someone for a piece of information that you are missing by making it look as if it is a legitimate request.",Phishing,"01J8M63J8HXTC590QC1GA16FXF",
"1b065b0f-6f0a-468d-802f-7cc556f1e432",PROD,"f2c96ad3-180d-4796-9eae-bd7d991e13dd",fc862918.AplSG5E.2.062,225,"fc862918.AplSG5E.2.062.xml",topic,"Flashcards 1: Exam 220-1102",2,SYBEX,"A ______________ is used for 360&hyphen;degree video surveillance.","PTZ camera","01J8M63JDFSJABPEYKN2MATYFQ",
"1b065b0f-6f0a-468d-802f-7cc556f1e432",PROD,"ab05bf9f-3e4a-43be-8f60-51fd0bbf8b2e",fc862918.AplSG5E.2.063,226,"fc862918.AplSG5E.2.063.xml",topic,"Flashcards 1: Exam 220-1102",2,SYBEX,"A ______________ is used to detect weapons when people enter into a building.",magnetometer,"01J8M63FV96WPS5QCTGD89V3PE",
"1b065b0f-6f0a-468d-802f-7cc556f1e432",PROD,"502a70a0-4fb9-4fc1-a19a-18088b665353",fc862918.AplSG5E.2.064,227,"fc862918.AplSG5E.2.064.xml",topic,"Flashcards 1: Exam 220-1102",2,SYBEX,"In ______ formatting, the drive controller chip and the drive meet for the very first time and learn to work together.","low&hyphen;level","01J8M63G0P0FQ9VAFFQS46E092",
"1b065b0f-6f0a-468d-802f-7cc556f1e432",PROD,"458a1e59-d6df-4cf7-9509-375c4070a6f9",fc862918.AplSG5E.2.065,228,"fc862918.AplSG5E.2.065.xml",topic,"Flashcards 1: Exam 220-1102",2,SYBEX,"Copying data, such as contacts, photos, and music, between a computer and a mobile device is referred to as what?",Synchronization,"01J8M63G6B2CPF7325Q9SX4AB1",
"1b065b0f-6f0a-468d-802f-7cc556f1e432",PROD,"43053716-aed2-4c86-85b0-24aea8b379f2",fc862918.AplSG5E.2.066,229,"fc862918.AplSG5E.2.066.xml",topic,"Flashcards 1: Exam 220-1102",2,SYBEX,"Apps developed for iOS will have a(n) ____ extension, and Android apps have a(n) ____ extension.","<code>.ipa</code>, <code>.apk</code>","01J8M63GBFAPH6A24R9D7HSS3X",
"1b065b0f-6f0a-468d-802f-7cc556f1e432",PROD,"f582ff0e-bf4c-42b1-93eb-48bc4fa7ff09",fc862918.AplSG5E.2.067,230,"fc862918.AplSG5E.2.067.xml",topic,"Flashcards 1: Exam 220-1102",2,SYBEX,"The __________ feature of Windows allows you to use drive encryption to protect files, including those needed for startup and logon.",BitLocker,"01J8M63GHH28HTP81XM3WPWZ8Q",
"1b065b0f-6f0a-468d-802f-7cc556f1e432",PROD,"5106a940-0a43-49fe-bbb0-94d0c77a9bc4",fc862918.AplSG5E.2.068,231,"fc862918.AplSG5E.2.068.xml",topic,"Flashcards 1: Exam 220-1102",2,SYBEX,"Mobile devices use fingerprints and facial recognition for what type of authentication?",Biometric,"01J8M63GPNEDBM1XR8KPW498KJ",
"1b065b0f-6f0a-468d-802f-7cc556f1e432",PROD,"0465b3a2-9581-471e-bf4c-53ec5e344f0a",fc862918.AplSG5E.2.069,232,"fc862918.AplSG5E.2.069.xml",topic,"Flashcards 1: Exam 220-1102",2,SYBEX,"For Android devices, ___________________ is an application that performs some of the same functions as Apple&rsquo;s Find My iPhone.","Find My Device","01J8M63GW5KMTV5R57WV02KWTK",
"1b065b0f-6f0a-468d-802f-7cc556f1e432",PROD,"adde83a5-935c-4ebb-8365-c368ea89e6a5",fc862918.AplSG5E.2.070,233,"fc862918.AplSG5E.2.070.xml",topic,"Flashcards 1: Exam 220-1102",2,SYBEX,"Why should you disable guest accounts?","To increase system security","01J8M63H1HT7KKDMJQMC61WERJ",
"1b065b0f-6f0a-468d-802f-7cc556f1e432",PROD,"b669d897-92fa-48ec-96e8-dfc691da3890",fc862918.AplSG5E.2.071,234,"fc862918.AplSG5E.2.071.xml",topic,"Flashcards 1: Exam 220-1102",2,SYBEX,"What is a valid reason for keeping firmware updated?","To patch security holes that may be found","01J8M63H6SKKM59SA8Y14KHSB2",
"1b065b0f-6f0a-468d-802f-7cc556f1e432",PROD,"d2447831-f58f-42d5-a2d8-d77f1c47e179",fc862918.AplSG5E.2.072,235,"fc862918.AplSG5E.2.072.xml",topic,"Flashcards 1: Exam 220-1102",2,SYBEX,"Which encryption technology requires a trusted platform module (TPM)?",BitLocker,"01J8M63FQMFC6JC1XMHTQSXAST",
"1b065b0f-6f0a-468d-802f-7cc556f1e432",PROD,"f8bd6b5a-d1df-49d8-849e-cb21eb50a6e5",fc862918.AplSG5E.2.073,236,"fc862918.AplSG5E.2.073.xml",topic,"Flashcards 1: Exam 220-1102",2,SYBEX,"A ______________ is an add&hyphen;on that changes the way a web page is rendered in the web browser.","plug&hyphen;in","01J8M63FX13KD9PJ1G0ATTED8N",
"1b065b0f-6f0a-468d-802f-7cc556f1e432",PROD,"7789ede0-2b39-4afa-a2d6-94e4138ee07b",fc862918.AplSG5E.2.074,237,"fc862918.AplSG5E.2.074.xml",topic,"Flashcards 1: Exam 220-1102",2,SYBEX,"________________ ______________ mode allows browsing the Internet without storing browser data.","Private browsing","01J8M63G2BRSWS3MW6S6VB5Q3V",
"1b065b0f-6f0a-468d-802f-7cc556f1e432",PROD,"9b4c9dc8-c2ab-4f06-97a5-e3c91ebf2e92",fc862918.AplSG5E.2.075,238,"fc862918.AplSG5E.2.075.xml",topic,"Flashcards 1: Exam 220-1102",2,SYBEX,"The ________ wireless frequency only has 3 nonoverlapping channels.","2.4 GHz","01J8M63G7ECHVYP61WQSA8TTER",
"1b065b0f-6f0a-468d-802f-7cc556f1e432",PROD,"8c1616b6-3053-47f1-abac-ec2fdb9314e3",fc862918.AplSG5E.2.076,239,"fc862918.AplSG5E.2.076.xml",topic,"Flashcards 1: Exam 220-1102",2,SYBEX,"_____________ allows for individual files to be encrypted.","Encrypted File System (EFS)","01J8M63GCW4QY18AAYFF1KKZVV",
"1b065b0f-6f0a-468d-802f-7cc556f1e432",PROD,"e3a009ab-8d7b-44b7-8954-f20889331506",fc862918.AplSG5E.2.077,240,"fc862918.AplSG5E.2.077.xml",topic,"Flashcards 1: Exam 220-1102",2,SYBEX,"A ______________________ happens when the Windows kernel crashes upon boot.","Blue Screen of Death (BSOD)","01J8M63GJE4SFRCFAH5MJ9D96S",
"1b065b0f-6f0a-468d-802f-7cc556f1e432",PROD,"99e5fb47-f75f-42c5-9183-d423722e6bea",fc862918.AplSG5E.2.078,241,"fc862918.AplSG5E.2.078.xml",topic,"Flashcards 1: Exam 220-1102",2,SYBEX,"The ______________ file can be checked for a failed driver during boot.",<code>NTBTLOG.TXT</code>,"01J8M63GQHXVNC0Q3MZETG6K9K",
