projectId,env,qtiId,title,order,href,placementType,topic,topicOrder,source,frontText,backText,resourceId,errors
"1b065b0f-6f0a-468d-802f-7cc556f1e432",PROD,"897bbb08-3fbb-4e15-9390-c208e4bf1917",fc862918.AplSG5E.3.120,408,"fc862918.AplSG5E.3.120.xml",topic,"Flashcards 2: Exam 220-1101",3,SYBEX,"If a laptop user is complaining about their mouse cursor jumping on the screen, disabling the ____ might help.",touchpad,"01J8M63EHCPQXYN93X657JKE87",
"1b065b0f-6f0a-468d-802f-7cc556f1e432",PROD,"ef7efd7c-ddf7-42ff-bb49-da57a44aabab",fc862918.AplSG5E.3.121,409,"fc862918.AplSG5E.3.121.xml",topic,"Flashcards 2: Exam 220-1101",3,SYBEX,"Which component in a laptop display allows for audio input?",Microphone,"01J8M63EQ0XGE5AECXNXS8F0QF",
"1b065b0f-6f0a-468d-802f-7cc556f1e432",PROD,"1a5d455f-49de-44e8-b702-21201e5e1b39",fc862918.AplSG5E.3.122,410,"fc862918.AplSG5E.3.122.xml",topic,"Flashcards 2: Exam 220-1101",3,SYBEX,"Which component in a laptop display can take input from a user&rsquo;s finger and turn it into digital data?",Digitizer,"01J8M63EW21ADGDFFKXS16GFM2",
"1b065b0f-6f0a-468d-802f-7cc556f1e432",PROD,"8453b283-02a7-44f7-921d-bde4b5323920",fc862918.AplSG5E.3.123,411,"fc862918.AplSG5E.3.123.xml",topic,"Flashcards 2: Exam 220-1101",3,SYBEX,"Which component in a laptop display allows for video input?",Webcam,"01J8M63F1TJET4YC8QZVMKQN03",
"1b065b0f-6f0a-468d-802f-7cc556f1e432",PROD,"979d2b19-c228-4a94-ad1e-60a6deb120d1",fc862918.AplSG5E.3.124,412,"fc862918.AplSG5E.3.124.xml",topic,"Flashcards 2: Exam 220-1101",3,SYBEX,"What is it called when a laptop gets on the Internet using a cellular connection?","Mobile hotspot","01J8M63F7AP33HXBBKRAVSGJWW",
"1b065b0f-6f0a-468d-802f-7cc556f1e432",PROD,"93571fc7-96e1-4924-a531-33d4983d82b8",fc862918.AplSG5E.3.125,413,"fc862918.AplSG5E.3.125.xml",topic,"Flashcards 2: Exam 220-1101",3,SYBEX,"Connecting a device to a mobile hotspot is referred to as what?",Tethering,"01J8M63FCJ5A2ESJK2K2BQYQ52",
"1b065b0f-6f0a-468d-802f-7cc556f1e432",PROD,"bd2af0e0-bf07-419e-b814-aed049e857a6",fc862918.AplSG5E.3.126,414,"fc862918.AplSG5E.3.126.xml",topic,"Flashcards 2: Exam 220-1101",3,SYBEX,"_______ allows you to turn off cellular and Wi&hyphen;Fi connections at once on a mobile device.","Airplane mode","01J8M63FHT1PYMNA9WP8Z17W4N",
"1b065b0f-6f0a-468d-802f-7cc556f1e432",PROD,"e60db646-13b2-4130-bedc-c09da4c45078",fc862918.AplSG5E.3.127,415,"fc862918.AplSG5E.3.127.xml",topic,"Flashcards 2: Exam 220-1101",3,SYBEX,"What does a PRL update do?","Updates the preferred roaming list, which tells the phone which cell towers to use when roaming","01J8M63B1KA810RZ091DC3Y5BG",
"1b065b0f-6f0a-468d-802f-7cc556f1e432",PROD,"abf42e8f-be86-42c3-8547-a66d2b694ce9",fc862918.AplSG5E.3.128,416,"fc862918.AplSG5E.3.128.xml",topic,"Flashcards 2: Exam 220-1101",3,SYBEX,"What are two locations to which you can sync an iPhone?","The desktop (iTunes) and the cloud (iCloud)","01J8M63B9M264A0RBPW6121TW1",
"1b065b0f-6f0a-468d-802f-7cc556f1e432",PROD,"5053d01c-8111-46ba-a2b6-3bcd637ec82e",fc862918.AplSG5E.3.129,417,"fc862918.AplSG5E.3.129.xml",topic,"Flashcards 2: Exam 220-1101",3,SYBEX,"What is it called when two Bluetooth&hyphen;enabled devices authenticate each other&rsquo;s identities?","Mutual authentication","01J8M63BFFRSTV2S0F7CWCEZ8Q",
"1b065b0f-6f0a-468d-802f-7cc556f1e432",PROD,"aeb881c8-e2ce-487e-9dd9-75cb273fed19",fc862918.AplSG5E.3.130,418,"fc862918.AplSG5E.3.130.xml",topic,"Flashcards 2: Exam 220-1101",3,SYBEX,"What service allows network administrators to set system policies and remotely wipe mobile devices on a network?","Mobile device management (MDM)","01J8M63BMR14GGT78HNX8ACPNH",
"1b065b0f-6f0a-468d-802f-7cc556f1e432",PROD,"b40fc2b6-2ad9-495d-ac16-5c967bf15945",fc862918.AplSG5E.3.131,419,"fc862918.AplSG5E.3.131.xml",topic,"Flashcards 2: Exam 220-1101",3,SYBEX,"Which service synchronizes mobile device email with a Microsoft Exchange server?",ActiveSync,"01J8M63BSV0PJ1C582FRJDV4EP",
"1b065b0f-6f0a-468d-802f-7cc556f1e432",PROD,"2a46aa5f-54cb-4dcc-87e4-c7e021a43014",fc862918.AplSG5E.3.132,420,"fc862918.AplSG5E.3.132.xml",topic,"Flashcards 2: Exam 220-1101",3,SYBEX,"Two examples of location services are ____ and ____.","GPS, cellular location services","01J8M63BZDK6Z8MFFFEGTSYPN0",
"1b065b0f-6f0a-468d-802f-7cc556f1e432",PROD,"7e2a94a4-6bec-4b7f-ae17-b59981ad9613",fc862918.AplSG5E.3.133,421,"fc862918.AplSG5E.3.133.xml",topic,"Flashcards 2: Exam 220-1101",3,SYBEX,"What is the second step in the best practice troubleshooting methodology?","Establish a theory of probable cause (question the obvious).","01J8M63C4HPH4Z2G3DGR3AGMX7",
"1b065b0f-6f0a-468d-802f-7cc556f1e432",PROD,"d9701310-d5eb-425c-b7ae-a5e0928544fa",fc862918.AplSG5E.3.134,422,"fc862918.AplSG5E.3.134.xml",topic,"Flashcards 2: Exam 220-1101",3,SYBEX,"What is the fourth step in the best practice troubleshooting methodology?","Establish a plan of action to resolve the problem and implement the solution.","01J8M63CA40JE7CXRKA0DTA0VB",
"1b065b0f-6f0a-468d-802f-7cc556f1e432",PROD,"6679602a-56d7-4170-a1af-04e9215a7133",fc862918.AplSG5E.3.135,423,"fc862918.AplSG5E.3.135.xml",topic,"Flashcards 2: Exam 220-1101",3,SYBEX,"What is the final step in the best practice troubleshooting methodology?","Document findings, actions, and outcomes.","01J8M63CGFABQS0STYA2V5J0RZ",
"1b065b0f-6f0a-468d-802f-7cc556f1e432",PROD,"ea12715d-3199-4ddd-8c0d-34dcd8f38890",fc862918.AplSG5E.3.136,424,"fc862918.AplSG5E.3.136.xml",topic,"Flashcards 2: Exam 220-1101",3,SYBEX,"When a system boots up, it provides a beep code. Where can you check to see what it means?","The BIOS manufacturer&rsquo;s website","01J8M63CNVFD4K2NFQ4Y1ZXF4S",
"1b065b0f-6f0a-468d-802f-7cc556f1e432",PROD,"685808d6-0853-43fb-b467-8ef8ea5517d1",fc862918.AplSG5E.3.137,425,"fc862918.AplSG5E.3.137.xml",topic,"Flashcards 2: Exam 220-1101",3,SYBEX,"If the system BIOS forgets the time and date after a reboot, what likely needs to be replaced?","CMOS battery","01J8M63CV5G6F33ERRQT36SAH4",
"1b065b0f-6f0a-468d-802f-7cc556f1e432",PROD,"c471ea2d-f772-4cf7-955b-37696d776b55",fc862918.AplSG5E.3.138,426,"fc862918.AplSG5E.3.138.xml",topic,"Flashcards 2: Exam 220-1101",3,SYBEX,"If you try to turn a desktop computer on and there is no power, what is the most likely device to cause this?","Power supply","01J8M63D11B2GZDNZYTMSBWPNX",
"1b065b0f-6f0a-468d-802f-7cc556f1e432",PROD,"b83f1b89-1481-40b4-9478-c2ef6ae113ed",fc862918.AplSG5E.3.139,427,"fc862918.AplSG5E.3.139.xml",topic,"Flashcards 2: Exam 220-1101",3,SYBEX,"Which devices in a computer are most likely to make unexpected loud noises, indicating a problem?","HDDs, fans, power supply","01J8M63D6E1XZX8ABKFK6ZQJFK",
"1b065b0f-6f0a-468d-802f-7cc556f1e432",PROD,"39d1ba78-8f1f-4b2f-8b44-edec6ccfac1c",fc862918.AplSG5E.3.140,428,"fc862918.AplSG5E.3.140.xml",topic,"Flashcards 2: Exam 220-1101",3,SYBEX,"What do switches and routers have that indicate if a port is working properly?","Indicator lights","01J8M63DBV2SJ6783H5YC89V5Q",
"1b065b0f-6f0a-468d-802f-7cc556f1e432",PROD,"6585539e-5c79-4e60-be6a-09247720cf1c",fc862918.AplSG5E.3.141,429,"fc862918.AplSG5E.3.141.xml",topic,"Flashcards 2: Exam 220-1101",3,SYBEX,"The Windows proprietary crash screen is called what?","Blue screen of death (BSOD)","01J8M63DHJ45S45AJNJEV3H02W",
"1b065b0f-6f0a-468d-802f-7cc556f1e432",PROD,"90afb7eb-2304-4439-be58-08c07a6c834b",fc862918.AplSG5E.3.142,430,"fc862918.AplSG5E.3.142.xml",topic,"Flashcards 2: Exam 220-1101",3,SYBEX,"Which component, when it fails, may be swollen or release a brownish&hyphen;red electrolyte?","Capacitor (distended capacitor)","01J8M63DPNQQF4M8GHM8GSPMVW",
"1b065b0f-6f0a-468d-802f-7cc556f1e432",PROD,"53ee992c-5f80-4e69-b2f6-f6b90ca79b5a",fc862918.AplSG5E.3.143,431,"fc862918.AplSG5E.3.143.xml",topic,"Flashcards 2: Exam 220-1101",3,SYBEX,"During which best practice troubleshooting methodology step should you conduct external or internal research?","Establish a theory of probable cause (step 2).","01J8M63DVR0773YW839PACRDRP",
"1b065b0f-6f0a-468d-802f-7cc556f1e432",PROD,"b4564eed-2c95-480b-a7fc-c22e3fc6916b",fc862918.AplSG5E.3.144,432,"fc862918.AplSG5E.3.144.xml",topic,"Flashcards 2: Exam 220-1101",3,SYBEX,"In the best practice troubleshooting methodology, which step should be taken after verifying full system functionality?","Document findings, actions, and outcomes.","01J8M63E0Y7P3D13F930918A4X",
"1b065b0f-6f0a-468d-802f-7cc556f1e432",PROD,"41585288-e423-4905-9324-1acfb17736f5",fc862918.AplSG5E.3.145,433,"fc862918.AplSG5E.3.145.xml",topic,"Flashcards 2: Exam 220-1101",3,SYBEX,"A small dark line across rows of printing on output from an impact printer indicates what?","A pin is stuck out in the printhead.","01J8M63FTPCAWSC5F4RDA4YVD3",
"1b065b0f-6f0a-468d-802f-7cc556f1e432",PROD,"b48695e8-c2f6-4584-ab4d-90a3895585ea",fc862918.AplSG5E.3.146,434,"fc862918.AplSG5E.3.146.xml",topic,"Flashcards 2: Exam 220-1101",3,SYBEX,"Blank pages from a laser printer could be caused by which three things?","The toner cartridge, the transfer corona assembly, or the high&hyphen;voltage power supply (HVPS)","01J8M63FZVWAPXFA4DCHN3XP6F",
"1b065b0f-6f0a-468d-802f-7cc556f1e432",PROD,"2eaeb501-15ce-4230-bcf4-fde3080f68f3",fc862918.AplSG5E.3.147,435,"fc862918.AplSG5E.3.147.xml",topic,"Flashcards 2: Exam 220-1101",3,SYBEX,"Vertical black lines on the output of a laser printer are caused by what?","A groove or scratch in the EP drum","01J8M63G52MXDNCE3CS4SFZ5W0",
"1b065b0f-6f0a-468d-802f-7cc556f1e432",PROD,"e53e2c56-e586-43e7-8a85-5c2ef01636a7",fc862918.AplSG5E.3.148,436,"fc862918.AplSG5E.3.148.xml",topic,"Flashcards 2: Exam 220-1101",3,SYBEX," Ghosting on a laser printer can be caused by ______ or ______.","A broken cleaning blade, bad erasure lamps","01J8M63GACPNABP3M9BM5ADJTT",
"1b065b0f-6f0a-468d-802f-7cc556f1e432",PROD,"e83ce564-3063-4a71-ab80-2cad1368763b",fc862918.AplSG5E.3.149,437,"fc862918.AplSG5E.3.149.xml",topic,"Flashcards 2: Exam 220-1101",3,SYBEX,"What is the most likely cause of a printer printing garbage?","The print driver","01J8M63GFPYZ2TFNA3JQXV1EFJ",
"1b065b0f-6f0a-468d-802f-7cc556f1e432",PROD,"1031bc30-8226-4028-9cf2-271764d841ed",fc862918.AplSG5E.3.150,438,"fc862918.AplSG5E.3.150.xml",topic,"Flashcards 2: Exam 220-1101",3,SYBEX,"If your inkjet printheads are dirty, what can you use to clean them?","An inkjet printer cleaning solution","01J8M63GMXAF18575P6DMWE21Q",
"1b065b0f-6f0a-468d-802f-7cc556f1e432",PROD,"d4561750-518b-4d6e-a76d-e1c239fba858",fc862918.AplSG5E.3.151,439,"fc862918.AplSG5E.3.151.xml",topic,"Flashcards 2: Exam 220-1101",3,SYBEX,"If your laser printer often experiences out&hyphen;of&hyphen;memory issues, what can you to do help solve the problem?","Upgrade the memory.","01J8M63GSXCT8CK1MQC77PSPVE",
"1b065b0f-6f0a-468d-802f-7cc556f1e432",PROD,"a04f5e8f-cf53-40b6-8edf-2554ab3a1fb9",fc862918.AplSG5E.3.152,440,"fc862918.AplSG5E.3.152.xml",topic,"Flashcards 2: Exam 220-1101",3,SYBEX,"If the computer has an error during POST, you will hear a ______.","beep code","01J8M63GYYBKJTH0YAQM0KK96A",
"1b065b0f-6f0a-468d-802f-7cc556f1e432",PROD,"1034f26c-de1f-4760-b101-8a2a0fa4bed7",fc862918.AplSG5E.3.153,441,"fc862918.AplSG5E.3.153.xml",topic,"Flashcards 2: Exam 220-1101",3,SYBEX,"If you are sending jobs to the printer but they&rsquo;re not printing, you should stop and restart the _______.","print spooler","01J8M63H4REJY1PQ1186YMACR1",
"1b065b0f-6f0a-468d-802f-7cc556f1e432",PROD,"20a71338-6534-4f38-89fc-6a905e623678",fc862918.AplSG5E.3.154,442,"fc862918.AplSG5E.3.154.xml",topic,"Flashcards 2: Exam 220-1101",3,SYBEX,"To test the printer, you should print a ____ from the client computer.","test page","01J8M63FS93SCW0PVZXPB1QQYS",
"1b065b0f-6f0a-468d-802f-7cc556f1e432",PROD,"15818fb8-cb71-49ca-a753-8a8584be9bfc",fc862918.AplSG5E.3.155,443,"fc862918.AplSG5E.3.155.xml",topic,"Flashcards 2: Exam 220-1101",3,SYBEX," The _____ toggles video on a laptop from LCD to external.","LCD cutoff switch","01J8M63FYTB2TRVB11BNDKJ8C4",
"1b065b0f-6f0a-468d-802f-7cc556f1e432",PROD,"d3c1205e-f504-4a9d-aabd-b3ec731f9106",fc862918.AplSG5E.3.156,444,"fc862918.AplSG5E.3.156.xml",topic,"Flashcards 2: Exam 220-1101",3,SYBEX,"The ____ key on a laptop allows you to perform tasks like toggling the video and dimming and brightening the LCD screen.","function (Fn)","01J8M63G435KDYV4JP31SMWP94",
"1b065b0f-6f0a-468d-802f-7cc556f1e432",PROD,"1cc342b2-e8da-40a1-a674-c617f41575e6",fc862918.AplSG5E.3.157,445,"fc862918.AplSG5E.3.157.xml",topic,"Flashcards 2: Exam 220-1101",3,SYBEX,"If built&hyphen;in wireless isn&rsquo;t working on a laptop, what should you should look for?","lights on the network card, or an external network card toggle switch","01J8M63G9GV3XPZG4MCRJDFA51",
"1b065b0f-6f0a-468d-802f-7cc556f1e432",PROD,"a815f17e-a3cc-43ae-a97a-4c1e0c7024e9",fc862918.AplSG5E.3.158,446,"fc862918.AplSG5E.3.158.xml",topic,"Flashcards 2: Exam 220-1101",3,SYBEX,"When macOS quits unexpectedly, what error will you receive?","A pinwheel","01J8M63GETH1X9PJ9EWR8QZXHD",
"1b065b0f-6f0a-468d-802f-7cc556f1e432",PROD,"8f726c8c-32e4-4b92-a4ef-131fe53e702a",fc862918.AplSG5E.3.159,447,"fc862918.AplSG5E.3.159.xml",topic,"Flashcards 2: Exam 220-1101",3,SYBEX,"What is S.M.A.R.T. technology used for?","To detect potential hard drive errors","01J8M63GNTVQHR5Z70HA8VZSE6",
"1b065b0f-6f0a-468d-802f-7cc556f1e432",PROD,"9cb3c01c-44ca-4f45-856b-fe99e7083781",fc862918.AplSG5E.3.160,448,"fc862918.AplSG5E.3.160.xml",topic,"Flashcards 2: Exam 220-1101",3,SYBEX,"What hardware tool is used to put the ends on UTP cables?",Crimper,"01J8M63GV7P2ZF2AKDZTKXFTMX",
"1b065b0f-6f0a-468d-802f-7cc556f1e432",PROD,"3306ad7d-1fd1-4e15-bebc-55df5bb7b833",fc862918.AplSG5E.3.161,449,"fc862918.AplSG5E.3.161.xml",topic,"Flashcards 2: Exam 220-1101",3,SYBEX,"If you believe you have a bad network cable, what tool can help you test it?","Cable tester","01J8M63H0M62291WV9RADFSJ02",
"1b065b0f-6f0a-468d-802f-7cc556f1e432",PROD,"82f844a3-a912-4443-8515-15038a58908b",fc862918.AplSG5E.3.162,450,"fc862918.AplSG5E.3.162.xml",topic,"Flashcards 2: Exam 220-1101",3,SYBEX,"What networking tool can make a copy of network traffic for additional analysis?","Network tap","01J8M63H62TQYRBZQWJV733E8N",
"1b065b0f-6f0a-468d-802f-7cc556f1e432",PROD,"bfa2ebbd-6335-4aa7-b510-8f397405274f",fc862918.AplSG5E.3.163,451,"fc862918.AplSG5E.3.163.xml",topic,"Flashcards 2: Exam 220-1101",3,SYBEX,"What is the most common cause of latency on a network?","Too many users (or too much traffic)","01J8M63FPDA0EMWKAPDGZ86V4E",
"1b065b0f-6f0a-468d-802f-7cc556f1e432",PROD,"bbb3f858-ab97-43ae-b69e-a60366fcbd19",fc862918.AplSG5E.3.164,452,"fc862918.AplSG5E.3.164.xml",topic,"Flashcards 2: Exam 220-1101",3,SYBEX,"Where do you set paper size and orientation?","Printing preferences of the printer","01J8M63FVTKTW69HR4J2KKG03J",
"1b065b0f-6f0a-468d-802f-7cc556f1e432",PROD,"5bf5031e-36f1-4cd6-99a3-18800d6694a9",fc862918.AplSG5E.3.165,453,"fc862918.AplSG5E.3.165.xml",topic,"Flashcards 2: Exam 220-1101",3,SYBEX,"What tool is used to connect wires to a 110&hyphen;block?","Punchdown tool","01J8M63G1K6VX9Z96R6DXFSEY8",
"1b065b0f-6f0a-468d-802f-7cc556f1e432",PROD,"3c981ef2-8b89-4f5b-8ba9-bbdabd08fd01",fc862918.AplSG5E.4.001,454,"fc862918.AplSG5E.4.001.xml",topic,"Flashcards 2: Exam 220-1102",4,SYBEX,"What is the minimum amount of free hard drive space recommended for installing a Windows 10, 64&hyphen;bit version?","32 GB","01J8M63G70RYCKDXRR0MJ5JF1K",
"1b065b0f-6f0a-468d-802f-7cc556f1e432",PROD,"875ad7d0-c112-46d8-8e2e-167076bde993",fc862918.AplSG5E.4.002,455,"fc862918.AplSG5E.4.002.xml",topic,"Flashcards 2: Exam 220-1102",4,SYBEX,"In Windows, once you&rsquo;ve configured the taskbar position and layout to your liking, you can configure it so that it can&rsquo;t be changed accidentally. To do so, right&hyphen;click the taskbar and select ___________________.","Lock The Taskbar","01J8M63GC74VYZ0XPRZFJXAJ2K",
"1b065b0f-6f0a-468d-802f-7cc556f1e432",PROD,"ebfebb25-d51f-493f-999a-bf3c15191f51",fc862918.AplSG5E.4.003,456,"fc862918.AplSG5E.4.003.xml",topic,"Flashcards 2: Exam 220-1102",4,SYBEX,"Where do files go when they are deleted?","Recycle Bin","01J8M63GJ5JVDWJ01YZW14WNWN",
"1b065b0f-6f0a-468d-802f-7cc556f1e432",PROD,"248c0518-6d72-4d1e-b447-101bf4a07a8d",fc862918.AplSG5E.4.004,457,"fc862918.AplSG5E.4.004.xml",topic,"Flashcards 2: Exam 220-1102",4,SYBEX,"Which Windows feature allows for automatic patching of the operating system?","Windows Update","01J8M63GQGB3RY1WJD5MSXER03",
"1b065b0f-6f0a-468d-802f-7cc556f1e432",PROD,"098e8707-d744-470b-83bf-78f3e479c2e6",fc862918.AplSG5E.4.005,458,"fc862918.AplSG5E.4.005.xml",topic,"Flashcards 2: Exam 220-1102",4,SYBEX,"Which life&hyphen;cycle term describes the currently supported operating system for patches, updates, and additional features?","Mainstream support","01J8M63GWRS9RSJR8MVFDKV0CT",
"1b065b0f-6f0a-468d-802f-7cc556f1e432",PROD,"df64f9fe-c74f-4cbe-98a0-4ceffde7aea1",fc862918.AplSG5E.4.006,459,"fc862918.AplSG5E.4.006.xml",topic,"Flashcards 2: Exam 220-1102",4,SYBEX,"What is the minimum required amount of RAM to install Windows 10 64&hyphen;bit?","2 GB","01J8M63H26X5Y7QCYE5Z53JTW4",
"1b065b0f-6f0a-468d-802f-7cc556f1e432",PROD,"cd605ca4-754b-4f43-9a0d-62888b7d8186",fc862918.AplSG5E.4.007,460,"fc862918.AplSG5E.4.007.xml",topic,"Flashcards 2: Exam 220-1102",4,SYBEX,"Which Microsoft feature allows for automatic VPN connectivity that is location based?",DirectAccess,"01J8M63FT7M0S0ZMHWSMZHCVQK",
"1b065b0f-6f0a-468d-802f-7cc556f1e432",PROD,"d35d790f-15cb-471a-b2b2-a73838faf5d6",fc862918.AplSG5E.4.008,461,"fc862918.AplSG5E.4.008.xml",topic,"Flashcards 2: Exam 220-1102",4,SYBEX,"Name three popular Linux distributions.","Red Hat, Ubuntu, Debian, Fedora, CentOS","01J8M63FZNENVFECCMMM7RF6HH",
"1b065b0f-6f0a-468d-802f-7cc556f1e432",PROD,"9beb39eb-15f3-49f1-80a2-ed2ade4a0b87",fc862918.AplSG5E.4.009,462,"fc862918.AplSG5E.4.009.xml",topic,"Flashcards 2: Exam 220-1102",4,SYBEX,"What type of operating system is optimized for background processes?",Servers,"01J8M63G4VGD8MD7P97R23THVY",
"1b065b0f-6f0a-468d-802f-7cc556f1e432",PROD,"51968820-86d0-4ab4-97d7-4a18417f12b5",fc862918.AplSG5E.4.010,463,"fc862918.AplSG5E.4.010.xml",topic,"Flashcards 2: Exam 220-1102",4,SYBEX,"What is the name of the Apple OS used on laptops and PCs?",macOS,"01J8M63GA2QC6GY4861QYX0WK5",
"1b065b0f-6f0a-468d-802f-7cc556f1e432",PROD,"5c879644-7d03-443f-aed4-7f620dd9a24e",fc862918.AplSG5E.4.011,464,"fc862918.AplSG5E.4.011.xml",topic,"Flashcards 2: Exam 220-1102",4,SYBEX,"Which architecture is primarily used for mobile tables and phones?",ARM,"01J8M63GFBQYW2AAN4JC05741M",
"1b065b0f-6f0a-468d-802f-7cc556f1e432",PROD,"e8f3d667-e366-4843-830a-6c373720eb9e",fc862918.AplSG5E.4.012,465,"fc862918.AplSG5E.4.012.xml",topic,"Flashcards 2: Exam 220-1102",4,SYBEX,"________ is the primary operating system that is installed on Apple iPads since version 13.1.",iPadOS,"01J8M63GMZMAAEYEE36R3VKCZF",
"1b065b0f-6f0a-468d-802f-7cc556f1e432",PROD,"349e74ee-1e36-4849-a7be-d08d8e3bfa1b",fc862918.AplSG5E.4.013,466,"fc862918.AplSG5E.4.013.xml",topic,"Flashcards 2: Exam 220-1102",4,SYBEX,"_________ support is the final support period for an operating system or software.",Extended,"01J8M63GTMG4ZKV0NRBXSXZ115",
"1b065b0f-6f0a-468d-802f-7cc556f1e432",PROD,"c335e92c-96d8-4cdc-a38e-20d229defb93",fc862918.AplSG5E.4.014,467,"fc862918.AplSG5E.4.014.xml",topic,"Flashcards 2: Exam 220-1102",4,SYBEX,"The ________ command will start the Disk Management snap&hyphen;in.","<code>diskmgmt.msc</code>","01J8M63H06ANJQBCXJEEWR2SSB",
"1b065b0f-6f0a-468d-802f-7cc556f1e432",PROD,"9d2d3ad9-7934-4205-8854-7d379b494188",fc862918.AplSG5E.4.015,468,"fc862918.AplSG5E.4.015.xml",topic,"Flashcards 2: Exam 220-1102",4,SYBEX,"___________________ is the process of preparing disk partitions to store data in a particular fashion.",Formatting,"01J8M63H59QJBND8VBVBZ8TYV9",
"1b065b0f-6f0a-468d-802f-7cc556f1e432",PROD,"03dfd7a2-097f-4986-9b27-87b15b63e245",fc862918.AplSG5E.4.016,469,"fc862918.AplSG5E.4.016.xml",topic,"Flashcards 2: Exam 220-1102",4,SYBEX,"The ________ Event Log contains events generated by the operating system.",System,"01J8M63BSH70BCCGA7P1P3QQNC",
"1b065b0f-6f0a-468d-802f-7cc556f1e432",PROD,"1cd6a0ba-c87f-4b91-a39a-0f03e6cec97e",fc862918.AplSG5E.4.017,470,"fc862918.AplSG5E.4.017.xml",topic,"Flashcards 2: Exam 220-1102",4,SYBEX,"A laptop keeps shutting down spontaneously. Check the sleep settings for ___________________, and disable them to see if it makes a difference.",Hibernation,"01J8M63BZ3JA49KDD9A6VTVB6Z",
"1b065b0f-6f0a-468d-802f-7cc556f1e432",PROD,"9b861977-6260-4431-9c66-6eb30bc8916c",fc862918.AplSG5E.4.018,471,"fc862918.AplSG5E.4.018.xml",topic,"Flashcards 2: Exam 220-1102",4,SYBEX,"Which Windows system utility can be used to edit the Registry?",REGEDIT,"01J8M63C4CCMJF5DD9GM2Z5QW7",
"1b065b0f-6f0a-468d-802f-7cc556f1e432",PROD,"03982a36-4def-4225-b799-fc9e6948fc65",fc862918.AplSG5E.4.019,472,"fc862918.AplSG5E.4.019.xml",topic,"Flashcards 2: Exam 220-1102",4,SYBEX,"The _________ command will start the Device Manager snap&hyphen;in.",<code>devmgmt.msc</code>,"01J8M63C9P7CBKSB85B32FGAG2",
"1b065b0f-6f0a-468d-802f-7cc556f1e432",PROD,"2cf80afb-b3ce-4ac6-b532-6e3198085ccf",fc862918.AplSG5E.4.020,473,"fc862918.AplSG5E.4.020.xml",topic,"Flashcards 2: Exam 220-1102",4,SYBEX,"Which Windows system utility can be used to make files on the hard drive contiguous?","Disk Defragmenter","01J8M63CEYX2CSZFG3C18A8QPW",
"1b065b0f-6f0a-468d-802f-7cc556f1e432",PROD,"2516d76f-1354-48c9-8bc4-aa068f91ecac",fc862918.AplSG5E.4.021,474,"fc862918.AplSG5E.4.021.xml",topic,"Flashcards 2: Exam 220-1102",4,SYBEX,"From which Control Panel applet can you choose to hide filename extensions on files when viewing them?","File Explorer Options","01J8M63CM72RKH8DC9FDG6FRDH",
"1b065b0f-6f0a-468d-802f-7cc556f1e432",PROD,"9b7dcc11-86b4-4faa-a50c-dcc9e4a8596f",fc862918.AplSG5E.4.022,475,"fc862918.AplSG5E.4.022.xml",topic,"Flashcards 2: Exam 220-1102",4,SYBEX,"From which Control Panel applet can you remove a username and password that is automatically filled in when you visit a web page?","Credential Manager","01J8M63CSGCQ7MB4A55FY7EEAY",
"1b065b0f-6f0a-468d-802f-7cc556f1e432",PROD,"046ad4f3-7f16-4d97-bb97-783225a515e3",fc862918.AplSG5E.4.023,476,"fc862918.AplSG5E.4.023.xml",topic,"Flashcards 2: Exam 220-1102",4,SYBEX,"_______ is a proprietary filesystem for Apple that contains support for SSD hard drives.","Apple File System (APFS)","01J8M63CZHBW559DNFZTMF5KVZ",
"1b065b0f-6f0a-468d-802f-7cc556f1e432",PROD,"ce64cc34-fdb0-46ab-82cf-df2a720b69ff",fc862918.AplSG5E.4.024,477,"fc862918.AplSG5E.4.024.xml",topic,"Flashcards 2: Exam 220-1102",4,SYBEX,"The ______________ will allow you to edit the local Group Policy for the operating system.","Group Policy Editor","01J8M63D58J6SA5YQTHXV8JKMY",
"1b065b0f-6f0a-468d-802f-7cc556f1e432",PROD,"e16c84ff-557a-4182-9cd5-ab732136d42a",fc862918.AplSG5E.4.025,478,"fc862918.AplSG5E.4.025.xml",topic,"Flashcards 2: Exam 220-1102",4,SYBEX,"Which Control Panel applet allows you to add features to the operating system?","Programs And Features","01J8M638HMZ34ZFZM3CQRHQ1FT",
"1b065b0f-6f0a-468d-802f-7cc556f1e432",PROD,"d304df71-ec2b-43e0-ba8d-eecd7b270d6f",fc862918.AplSG5E.4.026,479,"fc862918.AplSG5E.4.026.xml",topic,"Flashcards 2: Exam 220-1102",4,SYBEX,"How many days do you have after an upgrade to roll back to the prior operating system?","30 days","01J8M638QNK58XVK4GMZGF7HBT",
"1b065b0f-6f0a-468d-802f-7cc556f1e432",PROD,"0f67cf6c-5b6b-4a06-9ceb-2b8b2f968178",fc862918.AplSG5E.4.027,480,"fc862918.AplSG5E.4.027.xml",topic,"Flashcards 2: Exam 220-1102",4,SYBEX,"Which command allows you to map the drive of V to the UNC of <code>\\\\\\\\server\\\\files</code>?","<code>NET USE V: \\\\\\\\server\\\\files</code>","01J8M638Y0BWM31HH24B1P26WC",
"1b065b0f-6f0a-468d-802f-7cc556f1e432",PROD,"70535401-71d9-4ec0-bce5-f722d03a82df",fc862918.AplSG5E.4.028,481,"fc862918.AplSG5E.4.028.xml",topic,"Flashcards 2: Exam 220-1102",4,SYBEX,"What is the minimum speed processor is required to install Windows 10?","1 GHz or faster","01J8M6396ABPSME4XH5QBJYHY5",
"1b065b0f-6f0a-468d-802f-7cc556f1e432",PROD,"3ac00702-7ab3-4bc2-9301-846fe1cc0df2",fc862918.AplSG5E.4.029,482,"fc862918.AplSG5E.4.029.xml",topic,"Flashcards 2: Exam 220-1102",4,SYBEX,"What is the recommended edition of Windows 10 if you are upgrading from Windows 7 Home?","Windows 10 Home","01J8M639CH0NKEQCTYP4HBH5GG",
"1b065b0f-6f0a-468d-802f-7cc556f1e432",PROD,"b46adc79-c8bf-4c3d-9a80-ac41695d2172",fc862918.AplSG5E.4.030,483,"fc862918.AplSG5E.4.030.xml",topic,"Flashcards 2: Exam 220-1102",4,SYBEX,"During the setup of Windows 10, what are the license terms called that you must accept?","End&hyphen;user license agreement (EULA)","01J8M63B1BBNSGVB2WJE5Y7F64",
"1b065b0f-6f0a-468d-802f-7cc556f1e432",PROD,"5495c753-8d93-4b64-83e8-129558d0075b",fc862918.AplSG5E.4.031,484,"fc862918.AplSG5E.4.031.xml",topic,"Flashcards 2: Exam 220-1102",4,SYBEX,"You want to upgrade from Windows 10 Home to Windows 10 Pro; what is required?","A 25&hyphen;digit product key for Windows 10 Pro","01J8M63B91DDWDPV787J36CAKF",
"1b065b0f-6f0a-468d-802f-7cc556f1e432",PROD,"8cde793f-6adc-413f-a31b-33725a6ffac8",fc862918.AplSG5E.4.032,485,"fc862918.AplSG5E.4.032.xml",topic,"Flashcards 2: Exam 220-1102",4,SYBEX,"Which command&hyphen;line tool can be used to collect information about hardware before installing Windows 10?","<code>MSINFO32.EXE</code>","01J8M63BEE7Z7919GKQSJ9Q3T4",
"1b065b0f-6f0a-468d-802f-7cc556f1e432",PROD,"a83c6c2c-4983-4034-99b8-55d14c64910f",fc862918.AplSG5E.4.033,486,"fc862918.AplSG5E.4.033.xml",topic,"Flashcards 2: Exam 220-1102",4,SYBEX,"Which partition is the Boot Configuration Data stored in for Windows 10?","EFI System Partition (ESP)","01J8M63BM3GW4C7NBKFHF9KWGR",
