projectId,env,qtiId,title,order,href,placementType,topic,topicOrder,source,frontText,backText,resourceId,errors
"1b065b0f-6f0a-468d-802f-7cc556f1e432",PROD,"f452f462-6606-4340-9dde-f74c4e81db37",fc862918.AplSG5E.3.037,325,"fc862918.AplSG5E.3.037.xml",topic,"Flashcards 2: Exam 220-1101",3,SYBEX,"External storage devices will typically connect using one of which two technologies?","USB or eSATA","01J8M63CN264640TVF4K0FPPNM",
"1b065b0f-6f0a-468d-802f-7cc556f1e432",PROD,"c405a54d-dc57-490c-8301-1982888d5c8d",fc862918.AplSG5E.3.038,326,"fc862918.AplSG5E.3.038.xml",topic,"Flashcards 2: Exam 220-1101",3,SYBEX,"What is the difference between DVI&hyphen;A and DVI&hyphen;D?","DVI&hyphen;A is analog, DVI&hyphen;D is digital.","01J8M63CV491V088KKT7DM72T5",
"1b065b0f-6f0a-468d-802f-7cc556f1e432",PROD,"1f00f0d1-7986-4bb0-8c99-3709935d5f1d",fc862918.AplSG5E.3.039,327,"fc862918.AplSG5E.3.039.xml",topic,"Flashcards 2: Exam 220-1101",3,SYBEX,"How do you connect a DVI monitor to an HDMI video card?","By using a DVI&hyphen;to&hyphen;HDMI adapter","01J8M63D0WB32YZBHWDVCBM92G",
"1b065b0f-6f0a-468d-802f-7cc556f1e432",PROD,"2a6e783d-b8b9-4a8b-adbb-04e90a4fa56c",fc862918.AplSG5E.3.040,328,"fc862918.AplSG5E.3.040.xml",topic,"Flashcards 2: Exam 220-1101",3,SYBEX,"USB4 provides data rates of up to ____.","40 Gbps","01J8M63D6A4ZXMT1PD5DN5QFB4",
"1b065b0f-6f0a-468d-802f-7cc556f1e432",PROD,"867ba923-cb7e-44ed-abde-6176eee8ad98",fc862918.AplSG5E.3.041,329,"fc862918.AplSG5E.3.041.xml",topic,"Flashcards 2: Exam 220-1101",3,SYBEX,"USB4 was based on which standard?","Thunderbolt 3","01J8M63DBRBAH4FSDVCSTXYRA3",
"1b065b0f-6f0a-468d-802f-7cc556f1e432",PROD,"d0e45ff0-4172-402c-a91b-c0457b49a712",fc862918.AplSG5E.3.042,330,"fc862918.AplSG5E.3.042.xml",topic,"Flashcards 2: Exam 220-1101",3,SYBEX,"In the EP imaging process, what is the function of the laser?","It writes the image to the drum.","01J8M63DHK1FSDZ2Q4CF4MX0MR",
"1b065b0f-6f0a-468d-802f-7cc556f1e432",PROD,"cb1cc748-3b32-4224-8f08-26a9f2fddac0",fc862918.AplSG5E.3.043,331,"fc862918.AplSG5E.3.043.xml",topic,"Flashcards 2: Exam 220-1101",3,SYBEX,"What is the EP imaging process stage where the corona wire/roller acquires a strong positive charge (+600VDC) and applies that charge to the paper?",transferring,"01J8M63DQ3FN6SWDY4T6HWPGJ4",
"1b065b0f-6f0a-468d-802f-7cc556f1e432",PROD,"76104e0f-f64a-4e09-a15b-2d2d403b5efd",fc862918.AplSG5E.3.044,332,"fc862918.AplSG5E.3.044.xml",topic,"Flashcards 2: Exam 220-1101",3,SYBEX,"Which EP component takes wall voltage and converts it into current that the printer uses?","High voltage power supply (HVPS)","01J8M63DWATX38JXXFNAB3CXQV",
"1b065b0f-6f0a-468d-802f-7cc556f1e432",PROD,"625610f8-52dd-47dc-af1f-65ac7791b28f",fc862918.AplSG5E.3.045,333,"fc862918.AplSG5E.3.045.xml",topic,"Flashcards 2: Exam 220-1101",3,SYBEX,"During which EP imaging process step is a uniform negative charge (around &minus;600VDC) applied to the surface of the photosensitive drum?",charging,"01J8M63E1VK2E5N4A0J9NJ5EG5",
"1b065b0f-6f0a-468d-802f-7cc556f1e432",PROD,"d25002c6-d7e4-4ac0-97d9-171fbb06583e",fc862918.AplSG5E.3.046,334,"fc862918.AplSG5E.3.046.xml",topic,"Flashcards 2: Exam 220-1101",3,SYBEX,"During which step of the EP imaging process is toner transferred to the drum?",developing,"01J8M63B0WTDF5SH77GXNR4STE",
"1b065b0f-6f0a-468d-802f-7cc556f1e432",PROD,"e1b733a0-429e-4943-8118-58b5d2e33039",fc862918.AplSG5E.3.047,335,"fc862918.AplSG5E.3.047.xml",topic,"Flashcards 2: Exam 220-1101",3,SYBEX,"During which step of the EP imaging process does the toner move from the drum to the paper?",transferring,"01J8M63B8YXK72CP62KNK1MWDR",
"1b065b0f-6f0a-468d-802f-7cc556f1e432",PROD,"49704b5a-aa89-4ffc-a6c6-d3c0432e29c9",fc862918.AplSG5E.3.048,336,"fc862918.AplSG5E.3.048.xml",topic,"Flashcards 2: Exam 220-1101",3,SYBEX,"What will happen to the drum of an EP printer if it&rsquo;s exposed to light?","It will be ruined.","01J8M63BE4KQX8WMPV6J3R89SR",
"1b065b0f-6f0a-468d-802f-7cc556f1e432",PROD,"0e841903-2d43-48d2-9ffd-34e08ac4bfbe",fc862918.AplSG5E.3.049,337,"fc862918.AplSG5E.3.049.xml",topic,"Flashcards 2: Exam 220-1101",3,SYBEX,"Impact printer output is measured in terms of _____.","characters per second (CPS)","01J8M63BKAFBV8Y4P0PY9JAGWR",
"1b065b0f-6f0a-468d-802f-7cc556f1e432",PROD,"29998199-9776-4681-8ed3-4e4831efefbe",fc862918.AplSG5E.3.050,338,"fc862918.AplSG5E.3.050.xml",topic,"Flashcards 2: Exam 220-1101",3,SYBEX,"Printer cables should be a maximum of _____ feet long.",10,"01J8M63BRZJQK4EPRCP9MPQZH6",
"1b065b0f-6f0a-468d-802f-7cc556f1e432",PROD,"49ce4698-199c-44b7-82b5-21345298a7de",fc862918.AplSG5E.3.051,339,"fc862918.AplSG5E.3.051.xml",topic,"Flashcards 2: Exam 220-1101",3,SYBEX,"What is the process called when a 3D printer image is prepared for printing?",Slicing,"01J8M63BYNAA8YBYS3HY6H6PB6",
"1b065b0f-6f0a-468d-802f-7cc556f1e432",PROD,"329e3978-4a88-4e7a-a803-73f6a3b6eabb",fc862918.AplSG5E.3.052,340,"fc862918.AplSG5E.3.052.xml",topic,"Flashcards 2: Exam 220-1101",3,SYBEX,"What are two methods of authenticating to an MFD?","Typing in a username and password, and badging","01J8M63C4G5G9VAVKEAYR2M1MV",
"1b065b0f-6f0a-468d-802f-7cc556f1e432",PROD,"92b7917b-a69a-49d8-b910-ecb8fa6da09d",fc862918.AplSG5E.3.053,341,"fc862918.AplSG5E.3.053.xml",topic,"Flashcards 2: Exam 220-1101",3,SYBEX,"Where is a 3D image printed?","On the print bed","01J8M63C9TD6KXR2MTP7T2SP3N",
"1b065b0f-6f0a-468d-802f-7cc556f1e432",PROD,"fa14a128-1aea-4ccf-bbdd-522aac62f5d9",fc862918.AplSG5E.3.054,342,"fc862918.AplSG5E.3.054.xml",topic,"Flashcards 2: Exam 220-1101",3,SYBEX,"MFDs use SMB to do what?","Send a scan to a network folder","01J8M63CF85M47Z5N8PB1A4ZCV",
"1b065b0f-6f0a-468d-802f-7cc556f1e432",PROD,"bb2032be-6a83-4168-a70c-5d236d9303d5",fc862918.AplSG5E.3.055,343,"fc862918.AplSG5E.3.055.xml",topic,"Flashcards 2: Exam 220-1101",3,SYBEX,"If you have multiple LANs connected together by a slower&hyphen;speed connection, you have a ______.","wide area network (WAN)","01J8M63E637TS7SYK6D4RQAK5G",
"1b065b0f-6f0a-468d-802f-7cc556f1e432",PROD,"ae5dd808-461a-40b9-9db1-19d08425cbb0",fc862918.AplSG5E.3.056,344,"fc862918.AplSG5E.3.056.xml",topic,"Flashcards 2: Exam 220-1101",3,SYBEX,"A cloud&hyphen;based service that replicates the function of a router or switch is called what?","Software&hyphen;defined networking (SDN)","01J8M63EBJHY5YDRSZ916WF25Z",
"1b065b0f-6f0a-468d-802f-7cc556f1e432",PROD,"1745bf43-7862-4ec3-8af4-f7cbb3c7ff42",fc862918.AplSG5E.3.057,345,"fc862918.AplSG5E.3.057.xml",topic,"Flashcards 2: Exam 220-1101",3,SYBEX,"What is the device used to get Internet access from fiber&hyphen;optic lines coming from the ISP?","optical network terminal (ONT)","01J8M63EGW5F861XD6YMMBV3HW",
"1b065b0f-6f0a-468d-802f-7cc556f1e432",PROD,"78de594e-9003-4119-992e-d83fbf5212c2",fc862918.AplSG5E.3.058,346,"fc862918.AplSG5E.3.058.xml",topic,"Flashcards 2: Exam 220-1101",3,SYBEX,"What type of network cable does not produce poisonous gas when burned?",plenum,"01J8M63EPDVEGK9028EPVJ47PN",
"1b065b0f-6f0a-468d-802f-7cc556f1e432",PROD,"f71f1800-d7be-4f02-ae38-7337a18664d7",fc862918.AplSG5E.3.059,347,"fc862918.AplSG5E.3.059.xml",topic,"Flashcards 2: Exam 220-1101",3,SYBEX,"Coax cable uses what type of connector?","F type (BNC is also acceptable but is not an exam objective)","01J8M63EVY56KR1H01N6H1H57Z",
"1b065b0f-6f0a-468d-802f-7cc556f1e432",PROD,"0f6f9319-dc95-4785-a22e-83244c2b0ca7",fc862918.AplSG5E.3.060,348,"fc862918.AplSG5E.3.060.xml",topic,"Flashcards 2: Exam 220-1101",3,SYBEX,"What type of cable is used with a punchdown block?","Copper (specifically twisted pair)","01J8M63F11N2FZZEDV3954R8BZ",
"1b065b0f-6f0a-468d-802f-7cc556f1e432",PROD,"c82a6586-9c37-44a0-a042-19699e8e40fc",fc862918.AplSG5E.3.061,349,"fc862918.AplSG5E.3.061.xml",topic,"Flashcards 2: Exam 220-1101",3,SYBEX,"F type connectors are used for what type of cable?",coaxial,"01J8M63F6G41CMH5DT3CG4KZN1",
"1b065b0f-6f0a-468d-802f-7cc556f1e432",PROD,"4f5a02c3-1a8b-43d5-9980-e7d8073c406f",fc862918.AplSG5E.3.062,350,"fc862918.AplSG5E.3.062.xml",topic,"Flashcards 2: Exam 220-1101",3,SYBEX,"Two coaxial networking cable standards are ____ and ____.","RG&hyphen;6 and RG&hyphen;59","01J8M63FC8ZSRQY3FZGDS6ZFZK",
"1b065b0f-6f0a-468d-802f-7cc556f1e432",PROD,"cf7cd032-3f21-4f8c-9fbd-e7f5eef070cf",fc862918.AplSG5E.3.063,351,"fc862918.AplSG5E.3.063.xml",topic,"Flashcards 2: Exam 220-1101",3,SYBEX,"An RJ&hyphen;45 connector is used with what type of cable?","twisted pair","01J8M63FHCBW30CS5PFXB5DJ2A",
"1b065b0f-6f0a-468d-802f-7cc556f1e432",PROD,"da529e6c-268c-4e40-bb57-862c79db102a",fc862918.AplSG5E.3.064,352,"fc862918.AplSG5E.3.064.xml",topic,"Flashcards 2: Exam 220-1101",3,SYBEX,"_____ network cables are immune to crosstalk and RFI.","Fiber&hyphen;optic","01J8M63E3D0DJ4NFE5J656ARJA",
"1b065b0f-6f0a-468d-802f-7cc556f1e432",PROD,"c83e0704-b440-4486-9906-6fbaf66ebcf5",fc862918.AplSG5E.3.065,353,"fc862918.AplSG5E.3.065.xml",topic,"Flashcards 2: Exam 220-1101",3,SYBEX,"Two types of full&hyphen;size fiber&hyphen;optic connectors are ___ and ___.","SC (subscriber connector) and ST (straight tip)","01J8M63E8ZRE6W0812WQ3VAMBF",
"1b065b0f-6f0a-468d-802f-7cc556f1e432",PROD,"518d998a-7b32-4d61-afab-f1e522570a4e",fc862918.AplSG5E.3.066,354,"fc862918.AplSG5E.3.066.xml",topic,"Flashcards 2: Exam 220-1101",3,SYBEX,"A ____ or a ____ is usually the connectivity device at the center of a star network.","hub, switch","01J8M63EE78M2XCBCVKB6TYJ9F",
"1b065b0f-6f0a-468d-802f-7cc556f1e432",PROD,"81aac157-76eb-4a47-adca-4888708b9dcd",fc862918.AplSG5E.3.067,355,"fc862918.AplSG5E.3.067.xml",topic,"Flashcards 2: Exam 220-1101",3,SYBEX,"A Bluetooth network is called a ____. Multiple connected Bluetooth networks is called a _____.","piconet, scatternet","01J8M63EKMRT9JYD47XS2Q37GR",
"1b065b0f-6f0a-468d-802f-7cc556f1e432",PROD,"c597b36c-c0e0-4f0d-a0d6-dbb6b0796965",fc862918.AplSG5E.3.068,356,"fc862918.AplSG5E.3.068.xml",topic,"Flashcards 2: Exam 220-1101",3,SYBEX,"When network signals are sent using electrical outlets, that is called _______.","Ethernet over power","01J8M63ERXC3RN8M7SN4C4XBGB",
"1b065b0f-6f0a-468d-802f-7cc556f1e432",PROD,"8d7a299b-f4ba-4ec1-bb86-a3d30ab04772",fc862918.AplSG5E.3.069,357,"fc862918.AplSG5E.3.069.xml",topic,"Flashcards 2: Exam 220-1101",3,SYBEX,"A rack&hyphen;mounted device used to connect many network cables together is called a(n) _______.","patch panel","01J8M63EY8XY1H3YH94ZH44YNT",
"1b065b0f-6f0a-468d-802f-7cc556f1e432",PROD,"27663ae1-9880-42d4-8f0f-fbdddd472a60",fc862918.AplSG5E.3.070,358,"fc862918.AplSG5E.3.070.xml",topic,"Flashcards 2: Exam 220-1101",3,SYBEX,"UDP is a _______ protocol that operates at the _____ layer of the OSI model.","connectionless, Transport","01J8M63F3SNAAXBFSVZRHKBME3",
"1b065b0f-6f0a-468d-802f-7cc556f1e432",PROD,"2351e073-9c07-4a17-9512-9e0beef4eecd",fc862918.AplSG5E.3.071,359,"fc862918.AplSG5E.3.071.xml",topic,"Flashcards 2: Exam 220-1101",3,SYBEX,"Logical addresses in TCP/IP are handled by the _____ (protocol), which operates at the ____ layer of the OSI model.","IP, Network","01J8M63F92X0CR48DNXWR3VNKM",
"1b065b0f-6f0a-468d-802f-7cc556f1e432",PROD,"bc185ce5-5cda-45fa-a382-8c863e94379a",fc862918.AplSG5E.3.072,360,"fc862918.AplSG5E.3.072.xml",topic,"Flashcards 2: Exam 220-1101",3,SYBEX,"Physical network card addresses are called ______ addresses.","MAC (Media Access Control)","01J8M63FEEK54AWC9MXSHYA9YK",
"1b065b0f-6f0a-468d-802f-7cc556f1e432",PROD,"85bb2bdc-c2b2-45ed-822c-279397271c21",fc862918.AplSG5E.3.073,361,"fc862918.AplSG5E.3.073.xml",topic,"Flashcards 2: Exam 220-1101",3,SYBEX,"Which protocol is responsible for delivering error messages in TCP/IP?","ICMP (Internet Control Message Protocol)","01J8M63AY5PT7DZCWJ0WWPFJ3W",
"1b065b0f-6f0a-468d-802f-7cc556f1e432",PROD,"27406e63-8876-48da-a89f-2c218f4c4f68",fc862918.AplSG5E.3.074,362,"fc862918.AplSG5E.3.074.xml",topic,"Flashcards 2: Exam 220-1101",3,SYBEX,"Class B IP addresses will have a first octet of between ___ and ___.","128, 191","01J8M63B59RZ8K2S6BHADX0T14",
"1b065b0f-6f0a-468d-802f-7cc556f1e432",PROD,"fc91a772-7392-4f22-a5da-72350f2e217c",fc862918.AplSG5E.3.075,363,"fc862918.AplSG5E.3.075.xml",topic,"Flashcards 2: Exam 220-1101",3,SYBEX,"Class C IP addresses will have a first octet of between ____ and ___.","192, 223","01J8M63BB7T6DDNDZTXCTYTW49",
"1b065b0f-6f0a-468d-802f-7cc556f1e432",PROD,"db73c247-e1f9-41e6-8199-55f9a7c2606c",fc862918.AplSG5E.3.076,364,"fc862918.AplSG5E.3.076.xml",topic,"Flashcards 2: Exam 220-1101",3,SYBEX,"HTTP uses port ____, and HTTPS uses port ____.","80, 443","01J8M63BH4XJXGJG0QXWQZ8R65",
"1b065b0f-6f0a-468d-802f-7cc556f1e432",PROD,"8cd15ad0-e9f6-4634-9c04-68699de1255d",fc862918.AplSG5E.3.077,365,"fc862918.AplSG5E.3.077.xml",topic,"Flashcards 2: Exam 220-1101",3,SYBEX,"A ____ server resolves hostnames to IP addresses.","DNS (Domain Name System)","01J8M63BPDQ1HPK20KWJ9GSCRQ",
"1b065b0f-6f0a-468d-802f-7cc556f1e432",PROD,"c51a885e-30ad-4432-a41b-0dfaeec0d28a",fc862918.AplSG5E.3.078,366,"fc862918.AplSG5E.3.078.xml",topic,"Flashcards 2: Exam 220-1101",3,SYBEX,"To communicate on a TCP/IP network, which two things do you need?","A unique IP address and a valid subnet mask","01J8M63BWAJW1J9WX02T6EQ81G",
"1b065b0f-6f0a-468d-802f-7cc556f1e432",PROD,"4c6d0545-5617-4269-b83f-1f0b460d8d4d",fc862918.AplSG5E.3.079,367,"fc862918.AplSG5E.3.079.xml",topic,"Flashcards 2: Exam 220-1101",3,SYBEX,"Class A private IP addresses are in the ____ range.","10.0.0.0&ndash;10.255.255.255","01J8M63C1R6B72BZFQ96SD1E7W",
"1b065b0f-6f0a-468d-802f-7cc556f1e432",PROD,"b0385c35-1ff2-4b25-bedb-4b891190d5d4",fc862918.AplSG5E.3.080,368,"fc862918.AplSG5E.3.080.xml",topic,"Flashcards 2: Exam 220-1101",3,SYBEX,"The POP3 protocol is used to ___ mail and operates on port ___.","retrieve, 110","01J8M63C6Y8E6KEYK3BDVEGSWW",
"1b065b0f-6f0a-468d-802f-7cc556f1e432",PROD,"663d0847-eafb-4bc5-a7dd-460143cf9f9e",fc862918.AplSG5E.3.081,369,"fc862918.AplSG5E.3.081.xml",topic,"Flashcards 2: Exam 220-1101",3,SYBEX,"To communicate with computers on an external network using TCP/IP, your computer needs to be configured with a _____.","default gateway","01J8M63CCQ963X6EX2CRP0CM38",
"1b065b0f-6f0a-468d-802f-7cc556f1e432",PROD,"6296a27e-83bc-41b9-8c85-d380131ebc26",fc862918.AplSG5E.3.082,370,"fc862918.AplSG5E.3.082.xml",topic,"Flashcards 2: Exam 220-1101",3,SYBEX,"The IPv6 address ::1/128 is the _____ address.",loopback,"01J8M63B2MHRQEBC8H6GNXZ7CP",
"1b065b0f-6f0a-468d-802f-7cc556f1e432",PROD,"c137ed17-580a-4028-b7b5-cdc4798e5a05",fc862918.AplSG5E.3.083,371,"fc862918.AplSG5E.3.083.xml",topic,"Flashcards 2: Exam 220-1101",3,SYBEX,"Multicast IPv6 addresses start with ____.",FF00::,"01J8M63BAKQBDBB2AED9DXNVET",
"1b065b0f-6f0a-468d-802f-7cc556f1e432",PROD,"a4349ac9-788f-43f5-8878-5759e2d26d39",fc862918.AplSG5E.3.084,372,"fc862918.AplSG5E.3.084.xml",topic,"Flashcards 2: Exam 220-1101",3,SYBEX,"A secure point&hyphen;to&hyphen;point connection over a public network is called what?",VPN,"01J8M63BFQXX40T7DZVVQ77MMA",
"1b065b0f-6f0a-468d-802f-7cc556f1e432",PROD,"c3a692b2-a466-4b40-b0a1-c98f60840415",fc862918.AplSG5E.3.085,373,"fc862918.AplSG5E.3.085.xml",topic,"Flashcards 2: Exam 220-1101",3,SYBEX,"What is the DNS TXT record that authenticates email servers using a public&hyphen;private key pair?",DKIM,"01J8M63BNMV2KRB5X948QN5P4T",
"1b065b0f-6f0a-468d-802f-7cc556f1e432",PROD,"4b4f1068-06ad-4b0c-af37-8c780baed82d",fc862918.AplSG5E.3.086,374,"fc862918.AplSG5E.3.086.xml",topic,"Flashcards 2: Exam 220-1101",3,SYBEX,"What is the DNS TXT record that specifies how an email administrator wants flagged messages handled?",DMARC,"01J8M63BTXNYSPX5W679DN6P5W",
"1b065b0f-6f0a-468d-802f-7cc556f1e432",PROD,"6d8b07bc-34f0-4697-9d3f-097261858ad3",fc862918.AplSG5E.3.087,375,"fc862918.AplSG5E.3.087.xml",topic,"Flashcards 2: Exam 220-1101",3,SYBEX,"Cable TV and networking can use different types of ____ cable.",coaxial,"01J8M63C0CZGG65K64HA31HNM4",
"1b065b0f-6f0a-468d-802f-7cc556f1e432",PROD,"8dcd96f4-f6c3-45c9-b0cd-795e2c0597aa",fc862918.AplSG5E.3.088,376,"fc862918.AplSG5E.3.088.xml",topic,"Flashcards 2: Exam 220-1101",3,SYBEX,"The oldest type of twisted pair cabling that can support speeds of 1 Gbps is ___.","Cat 5e","01J8M63C5T13669DYBVGV8DZB4",
"1b065b0f-6f0a-468d-802f-7cc556f1e432",PROD,"b76f0327-9eee-4e2e-9677-4ca7ad1394d8",fc862918.AplSG5E.3.089,377,"fc862918.AplSG5E.3.089.xml",topic,"Flashcards 2: Exam 220-1101",3,SYBEX,"Dial&hyphen;up networking is limited to ____ (speed).","56 Kbps","01J8M63CBGEMM10T2X3G9TWE2S",
"1b065b0f-6f0a-468d-802f-7cc556f1e432",PROD,"82b750c5-9ba4-4aa8-bf4b-4b30a717cfcf",fc862918.AplSG5E.3.090,378,"fc862918.AplSG5E.3.090.xml",topic,"Flashcards 2: Exam 220-1101",3,SYBEX,"The wireless networking standard 802.11b operates at ____ (frequency) and supports _____ (speed).","2.4 GHz, 11 Mbps","01J8M63CH8KMMMZZEFW52JY248",
"1b065b0f-6f0a-468d-802f-7cc556f1e432",PROD,"3cfd0b97-f00b-4a74-9124-68026b467be4",fc862918.AplSG5E.3.091,379,"fc862918.AplSG5E.3.091.xml",topic,"Flashcards 2: Exam 220-1101",3,SYBEX,"The wireless networking standard 802.11g operates at ____ (frequency) and supports _____ (speed).","2.4 GHz, 54 Mbps","01J8M63B0RVW3GT2SG1C8G45TY",
"1b065b0f-6f0a-468d-802f-7cc556f1e432",PROD,"5c732226-8eca-46ec-a7f8-b4f8412c980e",fc862918.AplSG5E.3.092,380,"fc862918.AplSG5E.3.092.xml",topic,"Flashcards 2: Exam 220-1101",3,SYBEX,"Another name for a hub on a wireless network is a _____.","wireless access point (WAP)","01J8M63B8SVQ58HGPQS6X9GWZF",
"1b065b0f-6f0a-468d-802f-7cc556f1e432",PROD,"3dedea25-5aff-466b-b7a0-d29b1877477d",fc862918.AplSG5E.3.093,381,"fc862918.AplSG5E.3.093.xml",topic,"Flashcards 2: Exam 220-1101",3,SYBEX,"To only allow access to certain computers on your wireless router, you can use ___ filtering.",MAC,"01J8M63BE81QFSAYFCZT2YARJ4",
"1b065b0f-6f0a-468d-802f-7cc556f1e432",PROD,"62f89e6c-fbcd-44ea-bf4a-c04e6c1cb5eb",fc862918.AplSG5E.3.094,382,"fc862918.AplSG5E.3.094.xml",topic,"Flashcards 2: Exam 220-1101",3,SYBEX,"The T in 100BaseT refers to what?","Twisted pair cabling","01J8M63BKGKE553ER5MZ34DXS0",
"1b065b0f-6f0a-468d-802f-7cc556f1e432",PROD,"2f6596d0-bdef-401b-8fa7-378fe1a8bb42",fc862918.AplSG5E.3.095,383,"fc862918.AplSG5E.3.095.xml",topic,"Flashcards 2: Exam 220-1101",3,SYBEX,"Wireless 802.11b/g routers have a range of approximately ____ indoors and ____ outdoors.","40m, 140m","01J8M63BRG1YZ4YHWCG9FYG1JK",
"1b065b0f-6f0a-468d-802f-7cc556f1e432",PROD,"24a13d8a-6968-4f28-87c1-857affeedcee",fc862918.AplSG5E.3.096,384,"fc862918.AplSG5E.3.096.xml",topic,"Flashcards 2: Exam 220-1101",3,SYBEX,"WPA employs what security method?",TKIP,"01J8M63BXYMKRYGH7KPPB6TKRM",
"1b065b0f-6f0a-468d-802f-7cc556f1e432",PROD,"076320bb-d0b6-47e8-b180-1d5a9baed5ae",fc862918.AplSG5E.3.097,385,"fc862918.AplSG5E.3.097.xml",topic,"Flashcards 2: Exam 220-1101",3,SYBEX,"On a 2.4 GHz Wi&hyphen;Fi network, what are the three nonoverlapping channels?","1, 6, and 11","01J8M63C38S3W49J8C7GQJ6JQX",
"1b065b0f-6f0a-468d-802f-7cc556f1e432",PROD,"28988943-2559-41d9-a0c0-fd0a2db023b9",fc862918.AplSG5E.3.098,386,"fc862918.AplSG5E.3.098.xml",topic,"Flashcards 2: Exam 220-1101",3,SYBEX,"What technology is deigned to be &ldquo;plug and play&rdquo; for network devices?",UPnP,"01J8M63C8FP2PSV8GE4JFVT79K",
"1b065b0f-6f0a-468d-802f-7cc556f1e432",PROD,"5f289ceb-e503-4947-9e7d-d60a1f8f88d7",fc862918.AplSG5E.3.099,387,"fc862918.AplSG5E.3.099.xml",topic,"Flashcards 2: Exam 220-1101",3,SYBEX,"A _____ server receives print jobs and manages printers on a network.",Print,"01J8M63CDTR28941QX1K4KSMK6",
"1b065b0f-6f0a-468d-802f-7cc556f1e432",PROD,"68e77906-d0cc-48a1-8e93-461d88d5f178",fc862918.AplSG5E.3.100,388,"fc862918.AplSG5E.3.100.xml",topic,"Flashcards 2: Exam 220-1101",3,SYBEX,"What is the configuration file on a DNS server called?","Zone file","01J8M63CK3KJC6M8TW09DB7AWM",
"1b065b0f-6f0a-468d-802f-7cc556f1e432",PROD,"5287b459-afa2-4566-b35b-84dc42133c86",fc862918.AplSG5E.3.101,389,"fc862918.AplSG5E.3.101.xml",topic,"Flashcards 2: Exam 220-1101",3,SYBEX,"To be able to contact a DHCP server on a remote subnetwork, you need to install a _____ on the local subnetwork.","DHCP relay agent","01J8M63CREYCE3AKZ5C777PAS9",
"1b065b0f-6f0a-468d-802f-7cc556f1e432",PROD,"d333d3d5-8fdb-4d48-ac05-a5508a4fd232",fc862918.AplSG5E.3.102,390,"fc862918.AplSG5E.3.102.xml",topic,"Flashcards 2: Exam 220-1101",3,SYBEX,"A server that manages and audits security on a network is a ____ server.","authentication, authorization, and accounting (AAA)","01J8M63CXVTYX9VH2Y5Q0H1VY9",
"1b065b0f-6f0a-468d-802f-7cc556f1e432",PROD,"43ef55d0-581e-4f63-91fb-57355735441b",fc862918.AplSG5E.3.103,391,"fc862918.AplSG5E.3.103.xml",topic,"Flashcards 2: Exam 220-1101",3,SYBEX,"What type of server examines user credentials and grants them access to network resources?",Authentication,"01J8M63D30C8Y1Y34RNZJWTAY8",
"1b065b0f-6f0a-468d-802f-7cc556f1e432",PROD,"bec51980-d2cf-4844-9916-9ac8fd96afaf",fc862918.AplSG5E.3.104,392,"fc862918.AplSG5E.3.104.xml",topic,"Flashcards 2: Exam 220-1101",3,SYBEX,"Mail servers use which protocol and port to transfer mail between themselves?","SMTP, port 25","01J8M63D8GA77HTB9C160FD70H",
"1b065b0f-6f0a-468d-802f-7cc556f1e432",PROD,"5731b34d-9649-4082-8637-17b363590aa3",fc862918.AplSG5E.3.105,393,"fc862918.AplSG5E.3.105.xml",topic,"Flashcards 2: Exam 220-1101",3,SYBEX,"What type of Internet appliance helps spread out the work for web servers?","Load balancer","01J8M63DEB0BWY5SDJZSC0NMQC",
"1b065b0f-6f0a-468d-802f-7cc556f1e432",PROD,"ef9598c9-af57-4cf6-b30f-88498340dcbe",fc862918.AplSG5E.3.106,394,"fc862918.AplSG5E.3.106.xml",topic,"Flashcards 2: Exam 220-1101",3,SYBEX,"What is the term for cloud service where the provider offers storage only?","infrastructure as a service (IaaS)","01J8M63DMJFS946VHTN5GKDTWN",
"1b065b0f-6f0a-468d-802f-7cc556f1e432",PROD,"31e6bd2a-ac4c-4150-b250-1c16716c9155",fc862918.AplSG5E.3.107,395,"fc862918.AplSG5E.3.107.xml",topic,"Flashcards 2: Exam 220-1101",3,SYBEX,"What is the name of the software that allows for multiple VMs on a client computer?",Hypervisor,"01J8M63DT2YNH81QYKN2G239NA",
"1b065b0f-6f0a-468d-802f-7cc556f1e432",PROD,"fe183b59-0516-474d-b880-85bde9262464",fc862918.AplSG5E.3.108,396,"fc862918.AplSG5E.3.108.xml",topic,"Flashcards 2: Exam 220-1101",3,SYBEX,"What type of cloud is owned and used by an individual company?",Private,"01J8M63DZHX51FBDZNJQDFRC70",
"1b065b0f-6f0a-468d-802f-7cc556f1e432",PROD,"5f531759-7187-49db-9fc2-be6e73ef1a38",fc862918.AplSG5E.3.109,397,"fc862918.AplSG5E.3.109.xml",topic,"Flashcards 2: Exam 220-1101",3,SYBEX,"The ability of a cloud provider to bundle multiple physical servers together to appear as one set of resources to the client is called what?","Resource pooling","01J8M63FNNH0PWKJR2KFBE9MVN",
"1b065b0f-6f0a-468d-802f-7cc556f1e432",PROD,"734bea36-d338-4743-8896-7e3727bd61ef",fc862918.AplSG5E.3.110,398,"fc862918.AplSG5E.3.110.xml",topic,"Flashcards 2: Exam 220-1101",3,SYBEX,"Hypervisors manage VM network traffic and communicate to the physical NIC by using what?","Virtual switch","01J8M63FTW34ZFXYR0TJHAQZXV",
"1b065b0f-6f0a-468d-802f-7cc556f1e432",PROD,"d6acf185-8f7d-4aaf-81ba-659fcb8a54ec",fc862918.AplSG5E.3.111,399,"fc862918.AplSG5E.3.111.xml",topic,"Flashcards 2: Exam 220-1101",3,SYBEX,"Which type of server is used to collect messages such as error codes or security events from devices on the network?",syslog,"01J8M63G09VJCXTQCVG7HDK6HP",
"1b065b0f-6f0a-468d-802f-7cc556f1e432",PROD,"01011598-116b-4890-a571-f261e0cf8a31",fc862918.AplSG5E.3.112,400,"fc862918.AplSG5E.3.112.xml",topic,"Flashcards 2: Exam 220-1101",3,SYBEX,"The two most common laptop memory standards are ______ and ______.","SODIMM and MicroDIMM","01J8M63G5THCK35KP3HVXEPRCK",
"1b065b0f-6f0a-468d-802f-7cc556f1e432",PROD,"49e040dd-917f-4106-9c28-e70982b600ca",fc862918.AplSG5E.3.113,401,"fc862918.AplSG5E.3.113.xml",topic,"Flashcards 2: Exam 220-1101",3,SYBEX," A _________ is an extension of the motherboard of the laptop so that you can use full&hyphen;sized devices.","docking station or port replicator","01J8M63GBAZ963A6WXZPGDRDX0",
"1b065b0f-6f0a-468d-802f-7cc556f1e432",PROD,"de315ddb-3cbe-4fd7-985d-4aa3d85a3464",fc862918.AplSG5E.3.114,402,"fc862918.AplSG5E.3.114.xml",topic,"Flashcards 2: Exam 220-1101",3,SYBEX," A DDR4 SODIMM has a minimum of how many pins?",260,"01J8M63GHMMGEKM98F1WX47F2Z",
"1b065b0f-6f0a-468d-802f-7cc556f1e432",PROD,"83210d87-988b-43ad-90d0-ce01af800ceb",fc862918.AplSG5E.3.115,403,"fc862918.AplSG5E.3.115.xml",topic,"Flashcards 2: Exam 220-1101",3,SYBEX,"What is the power supply for the LCD called?",inverter,"01J8M63GQ0TEPSVT2PK5H0BS69",
"1b065b0f-6f0a-468d-802f-7cc556f1e432",PROD,"59a2e52d-77f3-44fc-8420-04ecc2f13621",fc862918.AplSG5E.3.116,404,"fc862918.AplSG5E.3.116.xml",topic,"Flashcards 2: Exam 220-1101",3,SYBEX,"What is the part of the LCD that is responsible for displaying information?",screen,"01J8M63GW0P36PJJZQKG5CFYNG",
"1b065b0f-6f0a-468d-802f-7cc556f1e432",PROD,"280bb456-700b-4e02-a429-55fbe1f38155",fc862918.AplSG5E.3.117,405,"fc862918.AplSG5E.3.117.xml",topic,"Flashcards 2: Exam 220-1101",3,SYBEX,"A typical type of backlight is a(n) ____ or a(n) ____.","cold cathode fluorescent lamp (CCFL), LED","01J8M63H16C8YE6N992N54AT8H",
"1b065b0f-6f0a-468d-802f-7cc556f1e432",PROD,"a6d92665-9395-44c2-8758-d637ad2fc9e9",fc862918.AplSG5E.3.118,406,"fc862918.AplSG5E.3.118.xml",topic,"Flashcards 2: Exam 220-1101",3,SYBEX,"Inverters provide ____&hyphen;voltage, ___&hyphen;frequency power.","high, high","01J8M63E6GZ3KC9FYH4SKY3PSN",
"1b065b0f-6f0a-468d-802f-7cc556f1e432",PROD,"2a9aaaab-2bb1-4ff6-906b-ccd9b12f0059",fc862918.AplSG5E.3.119,407,"fc862918.AplSG5E.3.119.xml",topic,"Flashcards 2: Exam 220-1101",3,SYBEX,"A DDR3 SODIMM has how many pins?",204,"01J8M63EC1843EK7MXK47593DQ",
