projectId,env,qtiId,title,order,href,placementType,topic,topicOrder,source,frontText,backText,resourceId,errors
bc9c4bfb-d976-4445-b258-f5d0fe417fbf,PROD,0db9e55e-802e-4639-b231-8d51b7d2356a,fc855835.AzDaFuSG.001,1,fc855835.AzDaFuSG.001.xml,coursewide,,,SYBEX,Data that is stored in JSON format can be described as what type of data?,Semi&hyphen;structured,01J0JRS9N4MPNCPHR822QSQZY5,
bc9c4bfb-d976-4445-b258-f5d0fe417fbf,PROD,acca5842-7b4b-473c-bb90-a13c09472524,fc855835.AzDaFuSG.002,2,fc855835.AzDaFuSG.002.xml,coursewide,,,SYBEX,True or False: Stream processing is the only logical component of a real&hyphen;time data processing solution.,"False. In addition to stream processing, real&hyphen;time data processing solutions include real&hyphen;time message ingestion engines, an analytical data store, and reporting.",01J0JRSA6SCWBKW3NM4RYX2RB7,
bc9c4bfb-d976-4445-b258-f5d0fe417fbf,PROD,ba68763b-7789-498e-a622-e12cf8ce0c60,fc855835.AzDaFuSG.003,3,fc855835.AzDaFuSG.003.xml,coursewide,,,SYBEX,A __________________ is a data store that provides the single source of truth for different functional areas within a business.,Data warehouse,01J0JRSAJ8DNF084TBPDD5KN7Y,
bc9c4bfb-d976-4445-b258-f5d0fe417fbf,PROD,4bf5b23d-39d2-4daf-a2e5-0991e4efa362,fc855835.AzDaFuSG.004,4,fc855835.AzDaFuSG.004.xml,coursewide,,,SYBEX,What are the four Vs of big data?,"Variety, velocity, volume, and value",01J0JRSAXWC3JE4S4VSQMR0387,
bc9c4bfb-d976-4445-b258-f5d0fe417fbf,PROD,349304c4-e199-4c63-be1d-8e5e36423eab,fc855835.AzDaFuSG.005,5,fc855835.AzDaFuSG.005.xml,coursewide,,,SYBEX,Which data manipulation pattern requires the transformation and storage components to be in the same engine?,"Extract, load, transform (ELT)",01J0JRSBEGYMEJ84GCPB6DYA79,
bc9c4bfb-d976-4445-b258-f5d0fe417fbf,PROD,7f818a5d-923a-428a-938f-8b70c81ef67e,fc855835.AzDaFuSG.006,6,fc855835.AzDaFuSG.006.xml,coursewide,,,SYBEX,"True or False: One of the core principles of data solutions that use a Lambda architecture is that raw data is immutable, meaning that it is never overwritten.","True. Data remains immutable in a Lambda architecture, taking advantage of scalable cloud storage solutions such as Azure Blob Storage to store data in several stages.",01J0JRSBT10Q744EX8XZCTWJFB,
bc9c4bfb-d976-4445-b258-f5d0fe417fbf,PROD,8b9a2763-d980-4755-a2ac-dbf3c18aebc7,fc855835.AzDaFuSG.007,7,fc855835.AzDaFuSG.007.xml,coursewide,,,SYBEX,What is Azure&rsquo;s MPP data warehouse service?,Azure Synapse Analytics dedicated SQL pools,01J0JRSC2KBW7DNP9WNVYTKAWT,
bc9c4bfb-d976-4445-b258-f5d0fe417fbf,PROD,aad5b344-3507-48ed-80b8-2a290a182ad2,fc855835.AzDaFuSG.008,8,fc855835.AzDaFuSG.008.xml,coursewide,,,SYBEX,What service on Azure is a fully managed Spark service that provides a workspace for Spark development and has first&hyphen;party integration with Azure services such as Azure Active Directory?,Azure Databricks,01J0JRSCDHP36XN0B0PWF80CPR,
bc9c4bfb-d976-4445-b258-f5d0fe417fbf,PROD,37493c36-31d2-4969-8a33-4daadebdb9c3,fc855835.AzDaFuSG.009,9,fc855835.AzDaFuSG.009.xml,coursewide,,,SYBEX,The Azure Cosmos DB Cassandra API is an example of what kind of NoSQL data store?,Columnar database,01J0JRSCRX7TTAQ457NNNW4Q4M,
bc9c4bfb-d976-4445-b258-f5d0fe417fbf,PROD,b9a72f5d-45c9-4b7c-bc56-64538db9f904,fc855835.AzDaFuSG.010,10,fc855835.AzDaFuSG.010.xml,coursewide,,,SYBEX,What are the no&hyphen;code data transformation components in Azure Data Factory?,Mapping data flows and Power Query,01J0JRSD3W25VE9AED83F0CG93,
bc9c4bfb-d976-4445-b258-f5d0fe417fbf,PROD,392fb2c3-337e-4303-ad20-2e113083c8c4,fc855835.AzDaFuSG.011,11,fc855835.AzDaFuSG.011.xml,coursewide,,,SYBEX,______________ are used to ensure the orderly processing of tasks in a data pipeline.,Control flows,01J0JRSDEGMAJN6KBYA2E3884Z,
bc9c4bfb-d976-4445-b258-f5d0fe417fbf,PROD,629ac103-0dc7-4f2a-85cb-8402786a181f,fc855835.AzDaFuSG.012,12,fc855835.AzDaFuSG.012.xml,coursewide,,,SYBEX,______________________ analytics involves using historical data to build statistical and machine learning models to forecast what will happen in the future.,Predictive,01J0JRSDQBZXKT367VWDFHZE91,
bc9c4bfb-d976-4445-b258-f5d0fe417fbf,PROD,6069d723-5b46-45e2-9699-f50bcc0fc60b,fc855835.AzDaFuSG.013,13,fc855835.AzDaFuSG.013.xml,coursewide,,,SYBEX,______________________ analytics combine several artificial intelligence and machine learning techniques such as deep learning and natural language processing to draw inferences from existing data and patterns.,Cognitive,01J0JRSE24Q5WZPVJTGCQ5GZ4Y,
bc9c4bfb-d976-4445-b258-f5d0fe417fbf,PROD,e725e15a-d629-4572-b622-9a6dad3982aa,fc855835.AzDaFuSG.014,14,fc855835.AzDaFuSG.014.xml,coursewide,,,SYBEX,Which chart type represent how a series of values change over time?,Line chart,01J0JRSEB3H32T8TZWDYZGVQ38,
bc9c4bfb-d976-4445-b258-f5d0fe417fbf,PROD,3ca3593f-dcce-4ff2-8911-03c776d33bd3,fc855835.AzDaFuSG.015,15,fc855835.AzDaFuSG.015.xml,coursewide,,,SYBEX,Which chart type show the relationship between two numerical values?,Pie chart,01J0JRSENS4QAY5GCX21XRNBT7,
bc9c4bfb-d976-4445-b258-f5d0fe417fbf,PROD,8ecd0498-b596-4dbf-9e99-166f836ab25f,fc855835.AzDaFuSG.016,16,fc855835.AzDaFuSG.016.xml,coursewide,,,SYBEX,What type of data visualization tool give analysts the ability to organize data into informational summaries to monitor how different areas of the organization are performing?,Reporting tools,01J0JRSEY6EEVJ46ZSHQDM79WG,
bc9c4bfb-d976-4445-b258-f5d0fe417fbf,PROD,eca044d4-430c-4be5-a76a-d064d2980c68,fc855835.AzDaFuSG.017,17,fc855835.AzDaFuSG.017.xml,coursewide,,,SYBEX,What scalable file system is Azure Data Lake Store Gen2 based on?,Hadoop Distributed File System (HDFS),01J0JRSF92Y2D8AXHGS1HR5YJ7,
bc9c4bfb-d976-4445-b258-f5d0fe417fbf,PROD,3b1ada0c-33bd-4f26-be85-e7f697a12161,fc855835.AzDaFuSG.018,18,fc855835.AzDaFuSG.018.xml,coursewide,,,SYBEX,______________________ provides a no&hyphen;code solution for citizen developers to perform data transformations in Azure Data Factory.,Power Query,01J0JRSFJ39PGSG6MHPXFY70RX,
bc9c4bfb-d976-4445-b258-f5d0fe417fbf,PROD,99652611-2b10-46b5-997b-5a9c35d83994,fc855835.AzDaFuSG.019,19,fc855835.AzDaFuSG.019.xml,coursewide,,,SYBEX,______________________ properties ensure data integrity in transactional databases.,"ACID (atomicity, consistency, isolation, durability)",01J0JRSFYBWJD5KZEFQTFM3VXD,
bc9c4bfb-d976-4445-b258-f5d0fe417fbf,PROD,ebe3f80f-10c1-4ddd-8e17-e9bfd70ec10b,fc855835.AzDaFuSG.020,20,fc855835.AzDaFuSG.020.xml,coursewide,,,SYBEX,What is the default isolation level for SQL Server and Azure SQL Database?,Read Committed,01J0JRSG8V078ADRE0TK78P6X8,
bc9c4bfb-d976-4445-b258-f5d0fe417fbf,PROD,06582241-c491-4be3-8e85-a4e69b054550,fc855835.AzDaFuSG.021,21,fc855835.AzDaFuSG.021.xml,coursewide,,,SYBEX,"Which type of data normalization involves eliminating repeating groups in individual tables, creating separate tables for each set of related data, identifying each set of related data with a primary key, relating tables with a foreign key, and eliminating fields in tables that do not depend on the foreign key?",Third normal form (3NF),01J0JRSGSQWBZ2TKRNFKZYWFDX,
bc9c4bfb-d976-4445-b258-f5d0fe417fbf,PROD,9b324b6c-4d44-4dcb-868b-d0b3d6f15581,fc855835.AzDaFuSG.022,22,fc855835.AzDaFuSG.022.xml,coursewide,,,SYBEX,Higher forms of data normalization such as 3NF are typically used for which type of relational database workload?,Transactional,01J0JRSH260MBXYS4JKFFPFT6Q,
bc9c4bfb-d976-4445-b258-f5d0fe417fbf,PROD,7b2eae98-b20f-4b73-a034-338d9dd92130,fc855835.AzDaFuSG.023,23,fc855835.AzDaFuSG.023.xml,coursewide,,,SYBEX,What is a common design pattern for data warehouses and OLAP models that classify tables as dimension and fact tables?,Star schema,01J0JRSHAXM1QJCC4EKE31SVQ8,
bc9c4bfb-d976-4445-b258-f5d0fe417fbf,PROD,87f7dd25-56f8-478d-9513-c8ca43449ffc,fc855835.AzDaFuSG.024,24,fc855835.AzDaFuSG.024.xml,coursewide,,,SYBEX,True or False: Local temporary tables are visible to any user after they are created and are deleted when all user sessions referencing the table are disconnected.,False. Local temporary tables are only visible to the user session they are created in and are dropped when the session is disconnected.,01J0JRSHKYG4GM3804A40WHJW0,
bc9c4bfb-d976-4445-b258-f5d0fe417fbf,PROD,8940d8c7-2730-4371-867c-dee6c4effc15,fc855835.AzDaFuSG.025,25,fc855835.AzDaFuSG.025.xml,coursewide,,,SYBEX,What type of relational database structure provides a virtual layer over multiple tables to allow users to easily query the data they need without needing to continuously write complex queries with multiple join and aggregation operations?,Views,01J0JRSHWF8CX59JG1Q02QK39E,
bc9c4bfb-d976-4445-b258-f5d0fe417fbf,PROD,34188b59-90dd-4142-b25d-116365d9fd5d,fc855835.AzDaFuSG.026,26,fc855835.AzDaFuSG.026.xml,coursewide,,,SYBEX,True or False: Clustered indexes physically sort and store data based on their values.,TRUE,01J0JRSJ572KZ9KEJBY2583F74,
bc9c4bfb-d976-4445-b258-f5d0fe417fbf,PROD,9ab7f0cc-dde4-4d47-8522-56077f3520a3,fc855835.AzDaFuSG.027,27,fc855835.AzDaFuSG.027.xml,coursewide,,,SYBEX,"What type of database objects consist of T&hyphen;SQL code that will run in response to a specific event such as a DDL, DML, or login action?",Trigger,01J0JRSJGCGRX0MQ3RW2VGMSYV,
bc9c4bfb-d976-4445-b258-f5d0fe417fbf,PROD,e14ceda3-3802-4383-aa83-6e96eca9fd0d,fc855835.AzDaFuSG.028,28,fc855835.AzDaFuSG.028.xml,coursewide,,,SYBEX,What are the three categories of cloud services that can be deployed in Azure?,"Infrastructure as a Service (IaaS), Platform as a Service (PaaS), Software as a Service (SaaS)",01J0JRSJV3GAW0HTH22ZKBG714,
bc9c4bfb-d976-4445-b258-f5d0fe417fbf,PROD,89a17b15-0923-48f5-8967-d309f69a79dc,fc855835.AzDaFuSG.029,29,fc855835.AzDaFuSG.029.xml,coursewide,,,SYBEX,Which Azure SQL offering falls under the IaaS category of cloud services?,SQL Server on Azure Virtual Machine,01J0JRSK4CVWRQC2BBZ14DY3N2,
bc9c4bfb-d976-4445-b258-f5d0fe417fbf,PROD,8e414e4b-e584-4ade-8afc-f2199314eaf2,fc855835.AzDaFuSG.030,30,fc855835.AzDaFuSG.030.xml,coursewide,,,SYBEX,True or False: Each Azure SQL offering includes hybrid licensing benefits that allow organizations to apply on&hyphen;premises SQL Server licenses to reduce the cost of the service.,TRUE,01J0JRSKDTW96VCQN60Q8JCGFS,
bc9c4bfb-d976-4445-b258-f5d0fe417fbf,PROD,208e1b9b-941d-4131-b04d-d0119920c5c9,fc855835.AzDaFuSG.031,31,fc855835.AzDaFuSG.031.xml,coursewide,,,SYBEX,What VM category is the Microsoft recommended choice for SQL Server on Azure VMs?,Memory Optimized,01J0JRSM3807V68F5DAWN3VDFE,
bc9c4bfb-d976-4445-b258-f5d0fe417fbf,PROD,bcd2b107-0e4f-4764-82ed-3fbdfb80af42,fc855835.AzDaFuSG.032,32,fc855835.AzDaFuSG.032.xml,coursewide,,,SYBEX,Which PaaS database offering on Azure provides near 100% feature compatibility with SQL Server?,Azure SQL Managed Instance (MI),01J0JRSMBAQRQWRYQP8B5D40X4,
bc9c4bfb-d976-4445-b258-f5d0fe417fbf,PROD,38146fd7-7cee-499b-a135-3600d96a6cd9,fc855835.AzDaFuSG.033,33,fc855835.AzDaFuSG.033.xml,coursewide,,,SYBEX,What are the two service tiers available for Azure SQL MI?,General Purpose and Business Critical,01J0JRSMVNV96N2CQPRVZ9VPC5,
bc9c4bfb-d976-4445-b258-f5d0fe417fbf,PROD,44cd3eee-0301-42d7-872f-a1c9091355ba,fc855835.AzDaFuSG.034,34,fc855835.AzDaFuSG.034.xml,coursewide,,,SYBEX,True or False: The subnet hosting an instance of Azure SQL MI can host other Azure services.,FALSE,01J0JRSN6DR1MVF90G1B9EDYXJ,
bc9c4bfb-d976-4445-b258-f5d0fe417fbf,PROD,3a56f741-510d-4d2b-81f2-54a778a91958,fc855835.AzDaFuSG.035,35,fc855835.AzDaFuSG.035.xml,coursewide,,,SYBEX,"Which Azure SQL Database deployment option represents a collection of databases with a shared set of resources, such as CPU or memory?",Elastic pool,01J0JRSNFF8SHWBAN0VVBPXYHY,
bc9c4bfb-d976-4445-b258-f5d0fe417fbf,PROD,b36574ef-d394-4d12-98ce-5d5180225d9f,fc855835.AzDaFuSG.036,36,fc855835.AzDaFuSG.036.xml,coursewide,,,SYBEX,"Which Azure SQL Database purchasing model provides the most resource options by allowing users to choose the number of vCores, the amount of memory, and storage speed?",The vCore&hyphen;based purchasing model,01J0JRSNRH8REHGK9QNXJ5JMCN,
bc9c4bfb-d976-4445-b258-f5d0fe417fbf,PROD,14795443-d2d6-4631-a9b3-fb1b3a1f23ad,fc855835.AzDaFuSG.037,37,fc855835.AzDaFuSG.037.xml,coursewide,,,SYBEX,__________________ allow specific IP address or a range of IP addresses to access either the logical server hosting one or more Azure SQL Databases or a single Azure SQL Database.,IP firewall rules,01J0JRSP188BSPSBGM3AFX81D0,
bc9c4bfb-d976-4445-b258-f5d0fe417fbf,PROD,77c67b34-e724-457a-b9b2-10b3c63a756e,fc855835.AzDaFuSG.038,38,fc855835.AzDaFuSG.038.xml,coursewide,,,SYBEX,"How often does Azure create full, differential, and transaction log backups for Azure SQL Databases?","Full backups are taken once a week, differential backups are taken every 12&ndash;24 hours, and transaction log backups are taken every 5&ndash;10 minutes.",01J0JRSPB0DKBW51D4HVWXF4YC,
bc9c4bfb-d976-4445-b258-f5d0fe417fbf,PROD,4c10c0e3-de37-45c0-814e-c9ab62a25897,fc855835.AzDaFuSG.039,39,fc855835.AzDaFuSG.039.xml,coursewide,,,SYBEX,What are the three distribution patterns that can be used to design Azure Synapse Analytics dedicated SQL pool tables?,"Hash distribution, round&hyphen;robin distribution, and replicated tables",01J0JRSPKX7JPECQPA9FS7R5WN,
bc9c4bfb-d976-4445-b258-f5d0fe417fbf,PROD,ddbdf465-f061-47f3-bd33-4696a156b00f,fc855835.AzDaFuSG.040,40,fc855835.AzDaFuSG.040.xml,coursewide,,,SYBEX,What scripting tools can be used to manage the deployment of different Azure services?,Azure PowerShell and Azure CLI,01J0JRSPWNPCS4V1GJ1QCH7646,
bc9c4bfb-d976-4445-b258-f5d0fe417fbf,PROD,f9ac98bd-5e06-42fe-b743-b8f39db96d95,fc855835.AzDaFuSG.041,41,fc855835.AzDaFuSG.041.xml,coursewide,,,SYBEX,__________________ templates are JSON files that define the resources and configuration requirements for a deployment to Azure. This is an example of Infrastructure as Code.,ARM,01J0JRSQ7ABGVFWVAYY5J4ESJF,
bc9c4bfb-d976-4445-b258-f5d0fe417fbf,PROD,77e813f9-bd73-4b1a-8ce7-47731c76c0ed,fc855835.AzDaFuSG.042,42,fc855835.AzDaFuSG.042.xml,coursewide,,,SYBEX,What Azure service can be used to manage the migration of an on&hyphen;premises SQL Server database to an Azure SQL Database?,Azure Database Migration Service (DMS),01J0JRSQJ9QJPH9KWGDC7NYK77,
bc9c4bfb-d976-4445-b258-f5d0fe417fbf,PROD,6853e720-2650-4a32-b6e3-7f555273be71,fc855835.AzDaFuSG.043,43,fc855835.AzDaFuSG.043.xml,coursewide,,,SYBEX,What methods are used to enforce data security for relational databases in Azure?,"Network isolation, access management, data encryption and obfuscation, and security management",01J0JRSQW4QVMQB9S5TZKBY9AJ,
bc9c4bfb-d976-4445-b258-f5d0fe417fbf,PROD,7516f68b-bff7-4efe-addf-c2dfa74a2926,fc855835.AzDaFuSG.044,44,fc855835.AzDaFuSG.044.xml,coursewide,,,SYBEX,__________________ statements are used to define database objects.,Data Definition Language (DDL),01J0JRSR4XQJXF253M1QTVZFB0,
bc9c4bfb-d976-4445-b258-f5d0fe417fbf,PROD,615026b5-cfb2-4b61-898c-a77764220c37,fc855835.AzDaFuSG.045,45,fc855835.AzDaFuSG.045.xml,coursewide,,,SYBEX,Which SQL constraint sets a value for a column if a value is not specified when a new row is inserted?,Default,01J0JRSRDHX5QXSCYYGSXPT59V,
bc9c4bfb-d976-4445-b258-f5d0fe417fbf,PROD,248ecb84-d2c1-46a0-96ee-2a1cb6db803f,fc855835.AzDaFuSG.046,46,fc855835.AzDaFuSG.046.xml,coursewide,,,SYBEX,What are the Unicode data types that are used to define string data?,NVARCHAR and NCHAR,01J0JRSRP7KE60NXJFVXXWPKAR,
bc9c4bfb-d976-4445-b258-f5d0fe417fbf,PROD,7ccaa127-364f-4875-b8eb-40d6f1da1c19,fc855835.AzDaFuSG.047,47,fc855835.AzDaFuSG.047.xml,coursewide,,,SYBEX,What are the different categories of NoSQL databases?,"Key&hyphen;value store, document database, columnar database, and graph database",01J0JRSRYT0PF38VCGKQ00DV7F,
bc9c4bfb-d976-4445-b258-f5d0fe417fbf,PROD,3c24c8b5-61be-4e5f-a13f-3a8ef71fc20a,fc855835.AzDaFuSG.048,48,fc855835.AzDaFuSG.048.xml,coursewide,,,SYBEX,What NoSQL data store is typically used for analytical workloads and are not well&hyphen;suited for transactional ones?,Columnar databases,01J0JRSS7Y78P5A8AZTGT17WVP,
bc9c4bfb-d976-4445-b258-f5d0fe417fbf,PROD,9c4e2bb9-4854-454f-b61c-0e71942efadb,fc855835.AzDaFuSG.049,49,fc855835.AzDaFuSG.049.xml,coursewide,,,SYBEX,How many APIs can be configured for a single Azure Cosmos DB account?,One per account,01J0JRSSGHANBGTZBAQWW6PZ81,
bc9c4bfb-d976-4445-b258-f5d0fe417fbf,PROD,3b7c33ee-f9f3-48b6-a8aa-43f2ea90b5f0,fc855835.AzDaFuSG.050,50,fc855835.AzDaFuSG.050.xml,coursewide,,,SYBEX,What is the native API to Azure Cosmos DB?,The Azure Cosmos DB Core (SQL) API,01J0JRSSXWWSENZ17SRNX9C0C4,
bc9c4bfb-d976-4445-b258-f5d0fe417fbf,PROD,adfffc83-4bdf-4d35-8143-930d09a33843,fc855835.AzDaFuSG.051,51,fc855835.AzDaFuSG.051.xml,coursewide,,,SYBEX,How many RUs does it cost to read a 1 KB item?,1 RU,01J0JRST6D67ZGW6EKYARPAWJ7,
bc9c4bfb-d976-4445-b258-f5d0fe417fbf,PROD,5f73b000-3f5a-459b-b80a-f7e2cec3d584,fc855835.AzDaFuSG.052,52,fc855835.AzDaFuSG.052.xml,coursewide,,,SYBEX,__________________ is a key&hyphen;value store that can be created in an Azure Storage Account.,Azure Table storage,01J0JRSTFE0WCWRGV6VBCJRTPD,
bc9c4bfb-d976-4445-b258-f5d0fe417fbf,PROD,340be2f4-7df3-489c-b51f-e8f6dc66fc18,fc855835.AzDaFuSG.053,53,fc855835.AzDaFuSG.053.xml,coursewide,,,SYBEX,What are the five consistency levels offered in Azure Cosmos DB?,"Strong, bounded staleness, session, consistent prefix, and eventual",01J0JRSTQZJT7JVMKTJMYK60T0,
bc9c4bfb-d976-4445-b258-f5d0fe417fbf,PROD,ea921a6c-800d-45dd-bd37-7fa1832fd11b,fc855835.AzDaFuSG.054,54,fc855835.AzDaFuSG.054.xml,coursewide,,,SYBEX,What format does the Azure Cosmos DB Core (SQL) API use to store data?,JSON,01J0JRSV2YMYQRB847BPVQS2Q4,
bc9c4bfb-d976-4445-b258-f5d0fe417fbf,PROD,5d1dbe3a-1ea9-4e40-a3df-3218025ecf49,fc855835.AzDaFuSG.055,55,fc855835.AzDaFuSG.055.xml,coursewide,,,SYBEX,What security mechanism is created to grant native Azure Cosmos DB users limited time access to Azure Cosmos DB resources?,Resource tokens,01J0JRSVBP3SJ5BGHH3Q9D6AP3,
bc9c4bfb-d976-4445-b258-f5d0fe417fbf,PROD,72aac9c8-2e0c-4f50-86f4-834859da7b68,fc855835.AzDaFuSG.056,56,fc855835.AzDaFuSG.056.xml,coursewide,,,SYBEX,What are the two bounded limits that can be configured to set the staleness window for Azure Cosmos DB accounts using the Bounded staleness consistency level?,Maximum lag time and the maximum lag operations,01J0JRSVMH4NKKGSGK89T2Z0SN,
bc9c4bfb-d976-4445-b258-f5d0fe417fbf,PROD,21dd6b0e-b71f-42a0-ae28-4e5ff40d51f8,fc855835.AzDaFuSG.057,57,fc855835.AzDaFuSG.057.xml,coursewide,,,SYBEX,Containers can be configured to use _________________ throughput.,Dedicated and shared,01J0JRSVX1Q5ZH55GVM6C7F8W9,
bc9c4bfb-d976-4445-b258-f5d0fe417fbf,PROD,6d2ff3ec-ef48-4e97-87d1-0dee45624beb,fc855835.AzDaFuSG.058,58,fc855835.AzDaFuSG.058.xml,coursewide,,,SYBEX,Azure Cosmos DB maintains ____ replicas of data in each region.,Four,01J0JRSW5ZYWH5VK24A8FSFRZN,
bc9c4bfb-d976-4445-b258-f5d0fe417fbf,PROD,d3d07bbe-5105-450c-b0aa-42a6e6732ca6,fc855835.AzDaFuSG.059,59,fc855835.AzDaFuSG.059.xml,coursewide,,,SYBEX,What is the unit of management for a set of Azure Cosmos DB containers?,A database,01J0JRSWNA7C4B20NS9PQ01T54,
bc9c4bfb-d976-4445-b258-f5d0fe417fbf,PROD,0f926f79-9098-4d3d-aeed-c2b14a75a8d4,fc855835.AzDaFuSG.060,60,fc855835.AzDaFuSG.060.xml,coursewide,,,SYBEX,Which Azure Cosmos DB API can be used to create a columnar database?,The Azure Cosmos DB Cassandra API,01J0JRSWXV966QEPXHDCW9FSB8,
bc9c4bfb-d976-4445-b258-f5d0fe417fbf,PROD,04899bbf-b4ba-4fa4-8b0c-36cb90d5e8d4,fc855835.AzDaFuSG.061,61,fc855835.AzDaFuSG.061.xml,coursewide,,,SYBEX,What is the minimum number of RU/s that can be allocated to a new Azure Cosmos DB container that has 20 GB of data?,400 RU/s,01J0JRSX6P897TCHTRG0AC8SMW,
bc9c4bfb-d976-4445-b258-f5d0fe417fbf,PROD,d076b312-a16f-470c-8971-1817eb935e92,fc855835.AzDaFuSG.062,62,fc855835.AzDaFuSG.062.xml,coursewide,,,SYBEX,"What type of storage is optimized to store large volumes of binary data, such as images, videos, and audio files?",Object storage,01J0JRSXGPCAJZNFSJVVAFDCBW,
bc9c4bfb-d976-4445-b258-f5d0fe417fbf,PROD,025f126e-4292-48e2-affc-2894ccec9d3c,fc855835.AzDaFuSG.063,63,fc855835.AzDaFuSG.063.xml,coursewide,,,SYBEX,What is the highest level of management for Azure Storage?,Storage account,01J0JRSXVB26BWSBHJ1Y265P11,
bc9c4bfb-d976-4445-b258-f5d0fe417fbf,PROD,7a7fbf74-2673-499d-9009-51d06f1929a7,fc855835.AzDaFuSG.064,64,fc855835.AzDaFuSG.064.xml,coursewide,,,SYBEX,True or False: Azure Files can be accessed via SMB and NFS protocols with the standard and premium performance tiers.,False. NFS for Azure Files is only available with the premium performance tier.,01J0JRSY631C1AME46TJ8B0MFM,
bc9c4bfb-d976-4445-b258-f5d0fe417fbf,PROD,c5c79294-ef9d-43c0-a413-7782d141cbcd,fc855835.AzDaFuSG.065,65,fc855835.AzDaFuSG.065.xml,coursewide,,,SYBEX,Which Azure Storage redundancy option creates three copies across three different availability zones in the same region?,Zone&hyphen;redundant storage (ZRS),01J0JRSYEZF362S8SRKA8A361V,
bc9c4bfb-d976-4445-b258-f5d0fe417fbf,PROD,491205e5-8391-4e4f-a6c9-46331bda3957,fc855835.AzDaFuSG.066,66,fc855835.AzDaFuSG.066.xml,coursewide,,,SYBEX,The ______ access tier for Azure Files uses standard HDDs for storage and is optimized for transaction heavy workloads.,Transaction optimized,01J0JRSYYD4ESX78E524SC9C3E,
bc9c4bfb-d976-4445-b258-f5d0fe417fbf,PROD,bc3c6c1e-af2f-4f3c-997f-91a5e97f3613,fc855835.AzDaFuSG.067,67,fc855835.AzDaFuSG.067.xml,coursewide,,,SYBEX,What service creates a local cache of an Azure file share on a local file server?,Azure File Sync,01J0JRSZ91NP5NM5VKT6N5HFE9,
bc9c4bfb-d976-4445-b258-f5d0fe417fbf,PROD,1be7a50e-0a1b-4708-a0dd-6895cffd278e,fc855835.AzDaFuSG.068,68,fc855835.AzDaFuSG.068.xml,coursewide,,,SYBEX,What blob type is optimized for storing OS and data disks for VMs and databases?,Page blobs,01J0JRSZKJQY6QC7WDP3TA4BBT,
bc9c4bfb-d976-4445-b258-f5d0fe417fbf,PROD,4eca9358-a05f-469f-8a72-55e94702a0c0,fc855835.AzDaFuSG.069,69,fc855835.AzDaFuSG.069.xml,coursewide,,,SYBEX,"When enabled, which feature enables Azure Data Lake Storage Gen2 for Azure Blob storage?",Hierarchical namespace,01J0JRSZYM18D01X22STMTYAX8,
bc9c4bfb-d976-4445-b258-f5d0fe417fbf,PROD,95428188-764a-43d7-83f1-31fb35ad6671,fc855835.AzDaFuSG.070,70,fc855835.AzDaFuSG.070.xml,coursewide,,,SYBEX,A ___________ is an access management method that delegates permissions to specific storage account resources over a predetermined period.,Shared access signature (SAS),01J0JRT0ABMBJYDVQTNMZRY489,
bc9c4bfb-d976-4445-b258-f5d0fe417fbf,PROD,7f218832-92f4-4393-9c6e-82b5a5ef1a0f,fc855835.AzDaFuSG.071,71,fc855835.AzDaFuSG.071.xml,coursewide,,,SYBEX,"When assigned, the ____________ Azure RBAC role will allow Azure AD identities to read, write, and delete data in Azure file shares over SMB.",Storage File Data SMB Share Contributor,01J0JRT0J98RPRWBW7Z5C3TYS5,
bc9c4bfb-d976-4445-b258-f5d0fe417fbf,PROD,2652220e-669a-4bbc-baf9-bfd7746af9fd,fc855835.AzDaFuSG.072,72,fc855835.AzDaFuSG.072.xml,coursewide,,,SYBEX,What permissions need to be assigned to an Azure AD identity to read specific data blobs when using access control lists (ACLs) for ADLS access management?,Read permissions on data and execute permissions on the directories that host the data.,01J0JRT0TYZTBYC7N8E7VX2WVD,
bc9c4bfb-d976-4445-b258-f5d0fe417fbf,PROD,37f62f68-99c7-4506-b1ac-0d90e63c1f29,fc855835.AzDaFuSG.073,73,fc855835.AzDaFuSG.073.xml,coursewide,,,SYBEX,"__________ is an Azure Storage feature that protects data from being accidentally deleted. When this feature is enabled, data can be recovered within a specified retention period.",Soft delete,01J0JRT15S2VCC1ZA4M84YWHNK,
bc9c4bfb-d976-4445-b258-f5d0fe417fbf,PROD,e9793f12-1899-4edb-ab43-eee7970669bf,fc855835.AzDaFuSG.074,74,fc855835.AzDaFuSG.074.xml,coursewide,,,SYBEX,What Azure service can be used to move data from on&hyphen;premises and cloud data stores to Azure Storage as a part of an ETL pipeline?,Azure Data Factory (ADF) and Azure Synapse Analytics Synapse pipelines,01J0JRT1F1T2BE7ZGCRE6PMM7G,
bc9c4bfb-d976-4445-b258-f5d0fe417fbf,PROD,a9f2ac09-671d-47e1-acc5-b5079859f2c6,fc855835.AzDaFuSG.075,75,fc855835.AzDaFuSG.075.xml,coursewide,,,SYBEX,Administrators can isolate PaaS resources like Azure storage accounts by attaching a private IP address from an Azure VNet with a ________.,Private endpoint,01J0JRT1TMK530N73ZSG26MZ1H,
bc9c4bfb-d976-4445-b258-f5d0fe417fbf,PROD,eb6c03d1-5b39-4f63-bd83-82df7c849b5e,fc855835.AzDaFuSG.076,76,fc855835.AzDaFuSG.076.xml,coursewide,,,SYBEX,What resources can be managed in Azure Storage Explorer?,"Any Azure Storage resource, including storage accounts, blob containers, ADLS directories, file shares, and data.",01J0JRT25A495D788Z1N83NQ21,
bc9c4bfb-d976-4445-b258-f5d0fe417fbf,PROD,ac042b21-c862-4b49-9b19-579e8ef644fb,fc855835.AzDaFuSG.077,77,fc855835.AzDaFuSG.077.xml,coursewide,,,SYBEX,What data processing technique is used to process large volumes of data at periods of time or after a specified event?,Batch processing,01J0JRT2DW5HC88PT262318H9M,
bc9c4bfb-d976-4445-b258-f5d0fe417fbf,PROD,b06fdaa8-996e-4098-9d6b-7c96a4f9310d,fc855835.AzDaFuSG.078,78,fc855835.AzDaFuSG.078.xml,coursewide,,,SYBEX,Data warehouse tables that store large volumes of quantifiable observations are referred to as ________.,Fact tables,01J0JRT2PNRR9H4863STTMN42N,
bc9c4bfb-d976-4445-b258-f5d0fe417fbf,PROD,84a8a631-ea93-4335-878e-460c3e3c51cb,fc855835.AzDaFuSG.079,79,fc855835.AzDaFuSG.079.xml,coursewide,,,SYBEX,"Azure HDInsight, Azure Synapse Analytics, and ________ can be used to deploy Spark clusters for data engineering and data science activities.",Azure Databricks,01J0JRT2ZR2F5EQF9FDZ8JXNK1,
bc9c4bfb-d976-4445-b258-f5d0fe417fbf,PROD,3e146f29-c1ed-40da-ae1a-065dd2632a4e,fc855835.AzDaFuSG.080,80,fc855835.AzDaFuSG.080.xml,coursewide,,,SYBEX,What open&hyphen;source service that can be deployed as an Azure HDInsight cluster can be used as a distributed real&hyphen;time message broker?,Apache Kafka,01J0JRT38K3MC1H0D8R91NE1BQ,
